"chaptername","chaptername href","chapterbody","chapterbody 2","chapterbody 3","chapterbody 4","chapterbody 5","chapterbody 6","chapterbody 7","chapterbody 8","chapterbody 9","chapterbody 10","chapterbody 11","chapterbody 12","chapterbody 13","chapterbody 14","chapterbody 15","chapterbody 16","chapterbody 17","chapterbody 18","chapterbody 19","chapterbody 20","chapterbody 21","chapterbody 22","chapterbody 23","chapterbody 24","chapterbody 25","chapterbody 26","chapterbody 27","chapterbody 28","chapterbody 29","chapterbody 30","chapterbody 31","chapterbody 32","chapterbody 33","chapterbody 34","chapterbody 35","chapterbody 36","chapterbody 37","chapterbody 38","chapterbody 39","chapterbody 40","chapterbody 41","chapterbody 42","chapterbody 43","chapterbody 44","chapterbody 45","chapterbody 46","chapterbody 47","chapterbody 48","chapterbody 49","chapterbody 50","firstcharacter","chapterbody 51","chapterbody 52","chapterbody 53"
"034 On Retreating from the Mind of Tao","https://reader.tbboyeh.org/fullscreen_player.php#/?ebook_id=1000542&chapter_id=c034","asked White Tara:","""If precepts are too strict, or we rigorously enforce Buddhist regulations, will it cause cultivation practitioners to retreat from the mind of Tao?""","White Tara answered:","""The mind of Tao is built on faith. People who believe in Buddhism trust deeply that Buddhadharma can save sentient beings from samsara. Those who continually rely upon this faith, and who have confidence, will definitely abide by the precepts, and respect Buddhist regulations.""","I asked:","""Some people say, they have retreated from the path of Tao.""","White Tara answered:","""If a person has a mind of Tao, he or she will never retreat.""","I asked:","""If he/she has retreated?""","White Tara answered:","""He/she never had a mind of Tao.""","I pondered this for a long time. A mind of Tao, a mind of Tao, retreating from the path of Tao, retreating from the mind of Tao...","Consequently:","Someone said: ""I want to retreat from the path of Tao!""","I answered: ""One who has a mind of Tao, will never retreat. You never had the mind of Tao after all.""","Someone said:","""I want to resume secular life!""","I replied:","""When have you ever lived the holy life? Being secular from the beginning, do you still need to resume secular life?""","(Please think very carefully about this issue.)","","* * *","","White Tara said:","""The mind of Tao is like the great sun, forever present. Suspended in the empty space, it is always there, and it never retreats or disappears. So-called retreat is one's own ignorance, cravings, hatred, and delusions, covering up the great sun. The great sun will never be lost; it is oneself who becomes lost, and not the mind of Tao.""","I asked White Tara:","""I have always advocated freedom and democracy. Would it be too severe to ask everyone to abide by precepts and follow Buddhist regulations?""","White Tara replied:","""So-called precepts are for the cessation of immorality. So-called regulations are guiding principles. These are to teach people to avoid and become free from faults, prejudices, hatred, discrimination, confusion, and lack of propriety.""","White Tara continued:","""Cultivators who strictly follow Buddhist regulations are like the dawn sky, totally clear and lucid. They are as transparent as crystal orbs. As the adage goes, a nation has national laws, a family has family rules, a sect has its regulations, and a temple has its rules. Total freedom and democracy would mean utter chaos.""","I asked:","""What does True Buddha School lack?""","White Tara answered:","""Management.""","""What is management?"" I asked.","White Tara answered:","""Precepts and regulations.""","I asked:","""What do our dharma propagators lack?""","White Tara replied:","""Some of them only seem to focus on money and material matters only. They expand their outreach, for the sake of making money. The dissemination of Buddhadharma is merely a pretext for them, and Buddhadharma and cultivation are not their core. This portion of people are aware that wealth cannot be carried away after death, but they continue ceaselessly in their delusion. Grandmaster Lu, how can you ensure that they do not fall into the three lower realms?""","I was stunned.","""They already have supernatural powers!"" I said.","White Tara responded:","""What they have are money-snatching powers, not supernatural powers.""","","","","I","","",""
"035 Superficial Clairvoyance","https://reader.tbboyeh.org/fullscreen_player.php#/?ebook_id=1000542&chapter_id=c035","hite Tara said:","""What they have are money-snatching powers and not supernatural powers!""","This statement led me to recall some fortune-tellers on the street, who specialize in telling people the ""karma linking their three lives of the past, present, and future."" (Knowing the karma of a person's three lives is a ""supernatural power."")","The fortune-teller would spin out tales about believers' karma in their past, present, and future lives. Then he would strike fear into your heart, by saying that some unfortunate event would happen.","After hearing these predictions your heart is filled with anxiety. The fortune-teller then says that these unfortunate mishaps can be dispelled or averted. However, a large sum of money is needed to ward off these calamities.","Consequently, you give a large sum of money. If all is well, the fortune-teller has successfully averted the disaster, and everyone is happy. If something bad actually happens, then the fortune-teller was also not wrong in his/her prediction, just that the sum of money to avert the disaster was insufficient, and more money is needed to ""replenish one's fortune.""","Can one believe in these accounts of karma linking past, present, and future lives? Amongst these, I feel that fake ones are in the majority. Many fortune-tellers who claim to have clairvoyance are swindlers with deceitfully persuasive tongues. Their ""clairvoyance"" is all a sham.","","* * *","","White Tara said:","There are many false claims of supernatural ability. For example, those without actual cultivation and mastery, who self-proclaim to have clairvoyance - this kind of clairvoyance is superficial.","If they are selfish and only intend to benefit themselves, they ask for money whether their mouths are open or closed, keep requesting money day in and day out, and self-proclaim to have clairvoyance, then their clairvoyance is definitely superficial.","If they do not abide by samaya, go against their Root Guru's wishes, not do what their Root Guru wants them to do, but instead, do the things that their Root Guru does not want them to do, and self-proclaim to have great clairvoyance - this kind of clairvoyance is superficial.","If they do not abide by the precepts, and violate the precepts pertaining to greed, anger, ignorance, doubt, arrogance, killing, stealing, lust, false speech, drinking of alcohol, and self-proclaim to have clairvoyance - this kind of clairvoyance is superficial.","If they do not have any genuine mastery of deep meditation and stability at all, and are merely depending on communication with ghosts, sprites, low-level spiritual entities, animal spirits, or minor deities, and self-proclaim to have clairvoyance - this kind of clairvoyance is extremely superficial.","Clairvoyance that did not arise from the cultivation of Buddhadharma, but derived from malevolent spirits. If they do not have any true knowledge of dharma or understanding of prajna at all, and self-proclaim to have clairvoyance - this kind of clairvoyance is superficial.","If they do not have bodhicitta, and do not know compassion for sentient beings, neither engaging at all in any deeds that benefit others, nor taking delight in charity whenever the situation arises, but are avidly zealous about the management of business enterprises, and self-proclaim to have clairvoyance - this kind of clairvoyance is superficial.","If they do not have a transcendental mind of renunciation, and all their actions are worldly and secular - trading in stocks, opening retail stores, buying and selling, dealing in currency exchange, gambling, frequenting pornographic establishments, dancing, singing, indulging in pleasures, competing for fame, contending for profit and gain, vying for territory... and they self-proclaim to have clairvoyance - this kind of clairvoyance is superficial.","If they lack right views, are deeply entrenched in habitual tendencies arising from ignorance, have many wrong views, and are enveloped by wickedness; if what they spread is not Buddhadharma, but instead they encourage people to only aspire for rebirth in the heavens, and self-proclaim to have clairvoyance - this kind of clairvoyance is superficial. If their speech and actions are not in accord with Dharma, and they self-proclaim to have clairvoyance - this kind of clairvoyance is superficial.","If they only know the meditation states of the Four Dhyana Heavens, from the First Dhyana Heaven to the Formless Heaven, are unaware that there are deeper and more profound states of meditation, and self-proclaim to have clairvoyance - this kind of clairvoyance is superficial.","False clairvoyance","Clairvoyance from ghosts and spirits","Minor clairvoyance","Clairvoyance from malevolent spirits","Clairvoyance from deities","Clairvoyance from the Four Dhyana meditation states","White Tara said:","""These individuals who self-proclaim to have supernatural ability are still within the confines of superficial clairvoyance, not to mention others.""","","","","","","","","","","","","","","","","","","","","","","W","","",""
"036 How Does One Extinguish Worries?","https://reader.tbboyeh.org/fullscreen_player.php#/?ebook_id=1000542&chapter_id=c036","hite Tara said:","""Only people who have severed and extinguished all their worries can qualify as saints or sages, great kind and wise friends, bodhisattvas, and buddhas.""","I asked:","""In this world, who is worry-free?""","White Tara said:","""Grandmaster Lu!""","I laughed out loud, ""Ha, ha, ha.""","Then I continued:","""In fact, I have a great many troubles! Why would you, White Tara, say that I have no worries?""","White Tara answered:","""You do not dwell on your troubles or let them bother you, hence, you have severed and extinguished all worries.""","I said:","""This statement is spot on.""","","* * *","","White Tara said:","If a Buddhist cultivator does not cultivate his mind to free himself of worries and afflictions, then even a thousand empowerments, or ten thousand empowerments would be of no use.","If a Buddhist cultivator has already reached enlightenment, but still has worries, then he is only enlightened in theory. In practice, he has not actualized enlightenment, so this still does not count as enlightenment.","If a Buddhist cultivator has faith in Dharma, but worries accumulate and increase as he cultivates, then there must be a mistake in his cultivation. For if cultivation cannot remedy worries, then this sort of cultivation is really of no benefit.","If a Buddhist cultivator practices extremely diligently, but the affliction of worries remains. He must seek and ask his Root Guru (a great kind and wise friend), where exactly did he go wrong in his cultivation?","If in the beginning one cultivates very diligently, but later on becomes weary of cultivation, slackens in practice, and feels no sense of accomplishment, then quickly go and ask one's Root Guru for advice about this problem!","How does one cultivate? With cultivation, some people's hearts become more confused and distracted, never at rest or tranquil, perpetually uneasy.","","Venerable Master Sheng Yen has said: ""A heart at ease is peace!""","This statement is very well said.","However, in this world, how many people are truly able to arrive at the state of ""a heart at ease""?","I would like to ask Venerable Master Sheng Yen:","""How does one have a heart at ease?""","I would tell everyone quite frankly, in this world, only one person has arrived at the state of a heart at ease, and this person is Living Buddha Lian-sheng, Sheng-Yen Lu.","Ha ha ha!","","White Tara said:","""One must cultivate precepts, meditation, and wisdom. One must be able to discover the essence of one's mind and realize one's buddha-nature. One has to actualize the dharma practice of a quiescent mind, understand the meaning of the secular world, and understand the absolute truths of Buddhadharma.""","If meditation is not able to sever and extinguish worries, if abiding by precepts cannot stop worries, if wisdom is also unable to bring an end to worries and troubles, not even the slightest bit, then the only recourse is to seek and ask advice from Root Guru Sheng-Yen Lu.","What should one do when facing suffering and adverse conditions?","Grandmaster Lu says:","Transform.","If one is unable to transform? Then what?","Detach.","If one is unable to detach from the problem? Then what?","Emptiness.","If one is unable to reach emptiness? Then what?","Then, I will tell you the true nature of worries, the true nature of humans, the true nature of the world, the true nature of sentient beings...","If you understand and realize this, then you are ""Shakyamuni Buddha!""","","","","","","W","","",""
"037 Signs of Attainment","https://reader.tbboyeh.org/fullscreen_player.php#/?ebook_id=1000542&chapter_id=c037","hite Tara said:","""Cultivators often speak of attainment, and some people even equate attainment with supernatural power. Actually, this is a very laughable matter, because attainment and supernatural powers are completely unrelated.""","","""Then what is attainment?"" I asked.","White Tara answered:","A cultivator is able to face and endure all kinds of suffering and hardships, and without feelings of suffering. This is the attainment of the realization of impermanence.","","When worries and afflictions do not arise in the mind of a cultivator, or even if worries arise, the cultivator is able to cease or subdue it immediately. This is the attainment of defeating the mara of worries and troubles.","","In all situations, whether favorable or adverse, a cultivator is always able to quiet his mind, to be completely without waves.","This is the attainment of meditative stability.","","A cultivator never tires of dharma practice, but cultivates diligently and persistently without slackening.","This is the attainment of the spontaneous accomplishment of the mind and qi.","","A cultivator regards his Root Guru as Buddha, and perceives his Root Guru's merits to be of Buddha, and his Root Guru's shortcomings as teachings.","This is the attainment of equanimity.","","When erroneous or discursive thoughts do not arise in a cultivator","(The attainment of stability)","When a cultivator dwells continuously in the lucid clarity of enlightenment","(The attainment of wisdom)","When a cultivator is immune to the Five Poisons","(The attainment of precepts)","White Tara said:","""True attainment refers to these. Only these are attainment. As for divine sight, divine hearing, knowledge of the minds of others, knowledge of previous lifetimes, unimpeded bodily action, and the cessation of outflows - these are supernatural powers, but only the power of the cessation of outflows can be counted as the attainment of the complete extinction of afflictions.""","","* * *","","White Tara continued:","Aside from these, there are some other small attainments, which will also be specially mentioned here:","Having less attachments.","Less worries and troubles, and a bit more understanding and clarity.","Not as selfish as before.","Less desire for fame and gain, letting things come and go naturally.","No longer envious of those more successful than oneself.","Departed from craving, seeking and gaining.","Abiding in the lucid clarity of meditative cultivation even when not meditating.","Whenever any thought arises, a cultivator is able to banish thoughts instantly without letting them dwell in his/her mind; this is the dharma practice of a quiescent mind.","Being accepting of both nirvana and reincarnation; this is the attainment of a mind of equanimity.","No longer seeking special relationships to climb the social ladder.","Abiding peacefully in all matters.","","* * *","","White Tara said:","There are some cultivators who self-proclaim that they have already achieved attainment, and their attainment is extremely great, so much so that they have ascended beyond nine levels of heavens.","If these cultivators:","Crave fame and status","Contend for profit and gain","W","Exaggerate false claims of supernatural power","Vie for territory","Mislead other cultivators (not in accord with Dharma)"
"038 Encountering a Rare and Precious Master","https://reader.tbboyeh.org/fullscreen_player.php#/?ebook_id=1000542&chapter_id=c038","hite Tara said:","""In this human world, it is not easy to meet a genuine precious master, as fake masters are everywhere and masters with real attainment are very few. Being able to encounter a rare and precious master is definitely due to the accumulation of good karma in previous lives.""","White Tara continued:","""It is not by chance that Grandmaster Lu appeared in this world. You are a rare and precious master replete with virtue and merit. The rare and precious masters that you yourself have met, such as Reverend Liaoming, His Eminence Sakya Zhengkong Rinpoche, His Holiness the 16th Karmapa, Vajra Acharya Thubten Dargye and so on, are all kind friends and companions on the path of cultivation from many previous lifetimes. These are not chance encounters or coincidences, but karmic affinity.""","White Tara then said:","""When people who want to cultivate happen to meet you, and then take refuge in you, these are also not by chance or coincidence, but rather the thread of affinity has linked everyone together. It is a basic fact that you are Amitabha Buddha. It is also a fact that there are countless padmakumaras. All of your cultivation natures from previous lives have been awakened, bringing about the encounters between holy disciples and a rare and precious master. These are all facts.""","","I asked:","""What about the ones who leave?""","White Tara answered: ""They are like the sun covered by clouds, like a sail boat blown off-course by a great wind, like a pearl necklace with a broken string, like eggs fallen from an overturned nest, like a wild goose separated from its flock... this human world is indeed not perfect. There will be a few camels amongst a flock of sheep, and insects can also grow in the rice barrel. At this time, a rare and precious master is also aware that this is Buddhadharma encountering baffling and inexplicable enmity, which is also a kind of teaching, best remedied by silence and patient endurance.""","I asked:","""Is there no way of saving them?""","White Tara answered:","""Bad karma and pollution from this world cause these disciples to leave their rare and precious master, this is also a fact. Their names are all listed in the . Only when their faith, intelligence and wisdom arise again, and through the teaching and empowerment of Re- Purification, can they then be rescued!""","White Tara said:","""It is because of the fact of these desertions that you, Grandmaster Lu, thoroughly understand the impermanence of conditioned phenomena, the selflessness of Dharma, nirvana and quiescence. This enabled the transformation of your heart to renounce the human world, to distance yourself from worldly life, and thus become enlightened about the true nature of reality. Isn't it so?""","","I asked:","""Why do disciples cast aside their genuine precious master?""","White Tara answered:","Their faith is not lasting, and if they are only momentarily touched by you, that is not enough.","Their faith is weak, while worldly inclinations are too strong.","They regard themselves too highly, and believe that their rare and precious master is ordinary.","They believe that they themselves are the leaders, and disregard their rare and precious master.","They deceive their rare and precious master, to gain profit and benefits.","Utterly disregarding their rare and precious master, they believe themselves to be more capable.","They obtain worldly gains under the guise of Buddhism.","They use their rare and precious master as a pretext, with the intention of burning the bridge after crossing the river.","Not actualizing cultivation, they have no proof of attainment.","Wandering about, having wavering faith, they follow profitable opportunities wherever these arise.","Exaggerating supernatural powers, they boast falsely about having attained enlightenment, proclaiming to be more powerful than the rare and precious master, mystifying fellow cultivators.","Having a fondness for stirring up troubles, they lack Buddhadharma in their hearts.","They are like wandering tricksters.","Their speech and actions are not in accord with Dharma, but they use their wits and twisted reasoning to justify and explain their inconsistencies.","Erroneous views.","I asked:","""Any more?""","White Tara answered:","""Are these not enough?""","","","","","","","","","","","","W","Highly Confidential Register of Those Fallen into the Three Lower Realms","",""
"039 Fake Masters","https://reader.tbboyeh.org/fullscreen_player.php#/?ebook_id=1000542&chapter_id=c039","asked:","""There are rare and precious masters; are there no fake ones?""","White Tara answered:","""How could there be none? Not only so, there are as many fake masters as there are carps in the river, while genuine precious masters are very difficult to find.""","I asked:","""Who are the fake masters?""","White Tara answered:","""All of their names have been listed in the !""","I asked:","""How could it be him or her?""","White Tara answered:","The ultimate aim of Buddhadharma is only for ""mastering one's own life and death,"" ""the extinction of afflictions,"" and ""disseminating Buddhadharma so that others may become emancipated too.""","When one abandons these three main goals, then one is a fake master without a doubt. For instance:","An erudite authority in Buddhism, who has studied and researched the Tripitaka in great depth and detail, and is able to understand all the Sutra, Vinaya, and Abhidharma Pitakas, but if he does not engage in actual cultivation, then this person is a fake master.","","For instance:","An eminent Buddhist scholar who has read more than three hundred books about Vajrayana Buddhism and has published quite a bit on this topic, but if this person has never taken refuge, received empowerment, and engaged in actual practice, then this person is a fake master.","","For instance:","There is a great master of a Buddhist sect, who likes politics and focuses wholeheartedly on political affairs, more so than his/her personal cultivation. Although this person may be renowned worldwide, he/she is similarly also a fake master.","","For instance:","There is a Vajrayana practitioner who has taken refuge, received empowerment, and uses money and persuasiveness to procure the empowerment to be an acharya master. Thereafter, this person proceeds to deceive the world. Lying to everyone that he/she cultivates when in reality he/she does not. This is also a fake master.","","For instance:","There is an acharya who frequently speaks about supernatural powers, exaggerating his/her own clairvoyance, speaking of clairvoyance as if it were the same as Buddhadharma, equating supernatural powers with attainment, and other such pretentious and inflated talk. Eventually, this becomes a habit.","In actual fact these are all bluff and bluster.","This kind of master is certainly a fake master.","","For instance:","An acharya who accumulates money, more so than cultivating his/her heart to become one with Buddhadharma, then this is definitely a fake master.","","For instance:","There is an acharya who pours his/her heart into building up his/her own position and fame, (wanting to climb the social ladder) by closely associating with world-famous people, and wants to become the most well-known master. (Overzealousness in climbing the social ladder.) In reality, his/her heart is not yet one with Buddhadharma; this is definitely a fake master.","","For instance:","An acharya who acquires a lot of disciples, and exerts great effort in expanding his/her territory, while his/her heart is not yet one with Buddhadharma; this is certainly a fake master.","","All in all:","An acharya, who focuses mostly on worldly gain, more so than transcendental attainment.","An acharya, who focuses on outward appearance, and overlooks inner cultivation.","An acharya, who is obsessed with clairvoyance, and does not know the ultimate fruition.","An acharya, who pursues fame and gain, false glory and flattery, and has not really actualized cultivation.","An acharya, who has committed many evil deeds, and does not abide by the precepts.","An acharya, who has turned away from his/her own Lineage Guru. All these, are fake masters.","","","","","","I","Highly Confidential Register of Those Fallen into the Three Lower Realms","",""
