"chaptername","chaptername href","chapterbody","chapterbody 2","chapterbody 3","chapterbody 4","chapterbody 5","chapterbody 6","chapterbody 7","chapterbody 8","chapterbody 9","chapterbody 10","chapterbody 11","chapterbody 12","chapterbody 13","chapterbody 14","chapterbody 15","chapterbody 16","chapterbody 17","chapterbody 18","chapterbody 19","chapterbody 20","chapterbody 21","chapterbody 22","chapterbody 23","chapterbody 24","chapterbody 25","chapterbody 26","chapterbody 27","chapterbody 28","chapterbody 29","chapterbody 30","chapterbody 31","chapterbody 32","chapterbody 33","chapterbody 34","chapterbody 35","chapterbody 36","chapterbody 37","chapterbody 38","chapterbody 39","chapterbody 40","chapterbody 41","chapterbody 42","chapterbody 43","chapterbody 44","chapterbody 45","chapterbody 46","chapterbody 47","chapterbody 48","chapterbody 49","chapterbody 50","firstcharacter","chapterbody 51","chapterbody 52","chapterbody 53"
"022 Endless Chatter","https://reader.tbboyeh.org/fullscreen_player.php#/?ebook_id=1000542&chapter_id=c022","hite Tara said:","""Unkind speech includes loose speech, and loose speech has three meanings. One, meaningless talk. Two, bawdy jokes. Three, endless idle chatter.""","","I would say:","""Buddhist cultivators should observe golden silence, and instead practice more inner-observation and mindfulness, because when there is excessive talking, it becomes meaningless chitchat. Firstly, it is a waste of precious time; secondly, too much talking inevitably leads to slips of the tongue. Thirdly, loose lips are often a cause of troubles. Fourthly, bawdy jokes are also a violation of samaya.""","I often hear people say:","We talked for three days and three nights.","We chatted all night until daybreak.","Bored people look for other bored people to chat with. They talk and talk, but in the end they still remain bored.","Many people like to chitchat.","Many people like to talk frivolously and endlessly.","White Tara said:","""It is better to utter less of insignificant words, idle chatter, and irrelevant comments, as wasting one's time and life will cause a person to be reborn in the three lower realms, and become cicadas, frogs, crickets and so on, incessantly croaking and chirping.""","""Chitchat has become a habit for people, who derive enjoyment from casual conversations.""","""For cultivators, delighting in meaningless and casual conversations not only compromises the recitation of Buddhas' epithets and mantras, inner-observation and mindfulness, meditation, diligence, and wisdom, it also causes cultivators to more easily break the samaya of speech.""","","I feel deeply that:","Human life is already very brief and fleeting as it is, and there is often not enough time. Moreover, people are all rushing about striving in their careers and businesses, such that the remaining amount of time left is barely sufficient for cultivation.","If time is spent on:","Chatting","Long-drawn-out and frivolous conversations","Meaningless talk","Wouldn't it be a waste?","","* * *","","Someone asked me:","""Grandmaster Lu, when you are on the dharma seat you expound dharma profusely; if these talks were compiled into books, wouldn't they fill up a book depository? If this is not endless talking, then what is?""","I replied:","""Not a single sentence was spoken!""","Someone asked me:","""Grandmaster Lu has personally written more than two hundred books, an endeavor that has taken forty years of time. This is also equivalent to endless and voluminous words in writing, does that mean this span of time has also been wasted?""","I answered:","""Not a single word was written!""","Someone asked:","""Are dialogues between Zen masters also considered as meaningless talk?""","I replied:","""Teachings.""","""What do they teach?""","""Flashes of lightning and sparks struck from flint, have been through many kalpas.""","""We don't understand?""","I replied:","""Don't be a bucket of paint... Quickly start thinking it through!""","I would say:","Dialogues between Zen masters are absolutely not idle chatter or meaningless talk. Great kind and wise teachers use speech to enlighten people; through the simplest statements, their words carry profound meaning, thunderous and deafening, to teach and guide sentient beings.","","My dharma talks are ""prajna.""","My writings are the ""wisdom of buddhas.""","","","W","","",""
"023 Sharp Tongues and Lips","https://reader.tbboyeh.org/fullscreen_player.php#/?ebook_id=1000542&chapter_id=c023","hite Tara said:","""Saying unkind words is 'harsh speech,' and this hateful way of speaking is indeed a source of creating negative karma. Words which hurt others, are a violation of samaya.""","White Tara said:","""Do not reveal the private matters of others, do not hurt others with harsh or abusive words, do not use obscene language, and also do not speak ill of others behind their backs.""","My opinion is:","Obscene language","Acrimonious or harsh speech","Humiliating or vilifying others","Exposing other people's private matters","These are all examples of karmic transgressions of ""harsh speech"" which break the samaya of speech!","","I remember a famous writer, who was very talented and intelligent, but he committed suicide. Before committing suicide, he left behind a note, on which four words were written: ""Human gossip is terrifying!""","These four words cause people to tremble with fear.","I remember an entrepreneur who was at the peak of his success. Because the media exposed a part of his private life, which was really not such a great failing, he committed suicide by jumping off the Penghu Bridge.","When I saw this news, I was greatly saddened.","All such events are due to ""harsh speech.""","","I realized:","Regardless of whether Chinese or foreign media, they all have tabloids. All of them have an attitude of not ceasing until they are able to provoke people with sensational words. They exert their utmost effort, regardless of the truth, and specialize in humiliating, criticizing or defaming others.","Many people like to watch these kinds of news, which is also one of the reasons why tabloid journalism is able to continue to exist.","Their main subject matter revolves around the exposure of the private lives of famous people.","Someone asked me:","""Are these kinds of media sinful?""","I replied:","""If the facts are true, the reports are correct, fair, just and objective, I think that is still acceptable. However, if the facts are biased, the reports are untrue, unjust, unfair and not objective, then I think, that is harsh speech!""","Actually, ""harsh speech"" does carry karmic retribution.","Descent into the three lower realms.","In future lives, their speech will often anger others.","They take pleasure in ""harsh speech.""","","* * *","","I have often said:","In this life, I grew amidst hurtful and defamatory speech. If I were to pay attention to these, there would be no end to handling them.","Therefore, I ignored all of it.","I am aware, since this is the ""human world,"" this is simply how the ""human world"" is.","Even though I clearly know that the defamatory accusations are untrue, however, I also do not wish to engage in debate to clear my name.","There was another group that made use of a spiritually disturbed woman, and greatly defamed me, but I did not respond.","Regarding news and articles by various media sources, I also did not care. Even if there were a great upheaval and the world was turned upside down, I would not be concerned. Even if disciples saw these reports and decided to turn their backs on me, I would also not care.","Why?","Because this is the ""human world.""","","* * *","","An awakened person knows that actually all living beings are of one body and all contain buddha-nature.","Sentient beings are one's parents or relatives from previous lives. I will not harm sentient beings.","Harming others is the same as harming oneself, and hurting others is the same as hurting oneself. Therefore, I vowed, I will never sue people.","When others slander me, this is the time they are teaching me to practice the ""paramita of patient endurance.""","Do not commit ""harsh speech.""","Because you are hurting yourself!","W","","",""
"024 Craving and Attachment to the Secular World","https://reader.tbboyeh.org/fullscreen_player.php#/?ebook_id=1000542&chapter_id=c024","hite Tara said:","""Spiritual practitioners should avoid clinging to worldly things, because craving for and attachment to the secular world will cause one not to advance, but instead fall. Worldly things include all tangible and intangible objects, such as: fame and status, money and possessions, beauty and sensual pleasures.""","White Tara said:","""A spiritual practitioner's mind of renunciation is very important. If one does not have a transcendental mind of renunciation, cultivation has no benefit. As its name suggests, a mind of renunciation would mean of course that one has to avoid clinging to worldly matters.""","White Tara said:","""Being unwilling to give, being covetous of others' money or possessions, being desirous of beauty or sensual pleasures, covetous of things that do not belong to oneself, craving for and attachment to fine and beautiful objects - these are all instances of clinging to worldly things.""","","I have said:","Money","Gold","Jewelry","Stocks","Plush residences","Luxury cars","These are all fine and beautiful worldly things. It is not wrong to have them, but one should not be too attached to them or crave them excessively. Do not desire for even more or even finer things if one has them already. Accumulation of money and possessions is in fact craving and attachment to the secular world.","We are all aware, that when we are born we do not bring anything with us, and when we die we will not be able to take anything with us. Worldly things are ""impermanent."" Even the rich are only temporary, as are dignitaries, celebrities and beauty; all of these last for only a time.","Therefore, White Tara urges us not to cling tightly to money, possessions, reputation, status, and beauty without letting go.","Spiritual practitioners know clearly and deeply that everything is ""impermanent.""","They will not crave or cling.","They will not be reluctant to give.","One should let things come and go naturally. Let what will come, come, and what will go, go. Regarding all fine and beautiful worldly things, let them not dwell in your heart; doing so is the practice of a ""quiescent mind,"" and the practice of a ""quiescent mind"" is the ""practice of prajna.""","","* * *","","There are three forms of karmic retribution that result from craving and attachment to the secular world:","1. Rebirth in the three lower realms","2. Even if one is reborn as a human being, one will be born in a land subject to famine, drought, and poverty","3. One's conduct will be miserly and petty","It is very important for spiritual practitioners to abandon ""craving and attachment to the secular world.""","","* * *","","I remember in the past there was a dharma propagator who competed with me over wealth.","I had a single Mercedes-Benz car, he bought three Mercedes-Benz cars.","I had one residence, he bought ten houses.","Later on, I had Rainbow Villa (which has now become True Buddha Rainbow Temple), and he also built a villa in the central region.","He said to everyone he met:","""I want to outdo Grandmaster Lu!""","I am called Living Buddha Lian-sheng.","On his business card, he printed: Living Buddha Lian-X.","Later on, he died.","I was greatly saddened in my heart.","","* * *","","There was another dharma propagator who traded stocks for a living, and he often asked me about the stock market.","I said:","""Stocks either rise or fall. If the charts don't resemble an 'M,' they would resemble a 'W.' These are all temporary!""","I said:","""Spiritual practitioners should not play the stock market. You are happy when you make a gain, depressed when you make a loss. Your mind is affected by the ups and downs of the stock market. A practitioner of Buddhism should not behave like this.""","W","","Later, he abandoned True Buddha School.","He was too attached to the secular world!"
"025 One Cannot Hate","https://reader.tbboyeh.org/fullscreen_player.php#/?ebook_id=1000542&chapter_id=c025","hite Tara said:","""One cannot hate! Hatred will cause one to descend to the three lower realms for sure, and hatred breaks the samaya vows. Practitioners, be careful, be careful!""","White Tara said:","""Love and hatred, although opposite, come in fact from the same origin, and they are one and the same. Hatred is enmity towards others. If one has ill will or hostile intent towards others, it already goes against Tao, and consequently one will fall into the three lower realms.""","White Tara said:","""Buddhadharma teaches great loving-kindness to all sentient beings including those whom one has no affinity with. Buddhadharma also teaches that one should have great compassion to others as though they were oneself. One should also have great benevolence and a mind of bodhicitta. Practitioners are able to understand all these dharma teachings, but, why can't they accomplish it?""","","After hearing White Tara's teaching, I began to sweat.","I know that the number of people who can accomplish this are far too few.","My view is:","The arising of hatred and loathing is due to many factors:","1. Discord between people","2. Jealousy","3. Envy","4. Love turned into hatred","Hatred originates as unkind thoughts, but the actions hatred gives rise to are to be feared. Practitioners have to avoid hatred. Do not commit evil deeds that harm oneself and others due to hatred.","We have seen too much of:","Discord between people, causing one to kill the other.","Out of jealousy, one kills the other.","Due to envy, one kills the other.","Love turns into hatred, and one kills the other.","(These can often be seen in the secular human world. Practitioners have to avoid hatred, and must not even have the thought of hatred, because this breaks the samaya vows.)","","As Vajrayana practitioners, we have to develop the Four Immeasurable Minds:","1. Infinite loving-kindness - give people happiness","2. Infinite compassion - alleviate others' suffering","3. Infinite joy - offer loving-kindness and compassion joyfully","4. Infinite equanimity - be willing to give even one's life and time","","* * *","","My personal belief is:","From the perspective that all sentient beings have ""buddha-nature,"" from the perspective that all sentient beings are equal and not different, from the perspective that all sentient beings and oneself are of the same body—","Practitioners cannot hate!","Hatred will absolutely lead one to fall into the three lower realms! For example:","A woman endlessly slandered me, but I cannot hate.","A disciple who left, slandered me endlessly, but I cannot hate.","Instead, I would vow not to give up on any sentient being, and always give rise to great bodhicitta.","Thus so. And so it is. Another example:","The affair between former U.S. President Clinton and Monica Lewinsky once made headline news around the world.","This is a real example of ""love turned to hatred.""","Hatred is really terrifying.","Thus, there are many, many examples of romantic relationships ending violently.","When loving each other, the world turns upside down. When loathing each other, the world is similarly thrown into upheaval.","Because this is the human realm, and sentient beings are all worldly people.","However, the teachings of Buddha are different from those of ordinary people.","Practitioners need to accept Buddha's teaching.","""One cannot hate!""","I would like to tell holy disciples quite frankly, if you have a heart of enmity, then you are not a practitioner of Mahayana, or even a practitioner of Theravada.","If someone hates you, you cannot hate him. You must even try to save him instead, only then are you a practitioner!","W","","",""
"026 Pride and Prejudice","https://reader.tbboyeh.org/fullscreen_player.php#/?ebook_id=1000542&chapter_id=c026","hite Tara said:","""If one has not yet become enlightened, but claims that one has. This is exaggeration! If one has no supernatural ability, but claims that one has already attained great supernatural ability. This is also exaggeration! When one has neither true enlightenment nor real attainment, and exaggerates oneself, this is the overinflation of one's ego, which becomes false pride and arrogance.""","White Tara said:","""When a person without true enlightenment and attainment talks about Buddhist teachings, this gives rise to prejudiced views. For example, eternalism or nihilism, or other views such as, asceticism is the highest and unsurpassed form of cultivation; the universe is a temporary composite body.""","White Tara said:","""These are all wrong views, which will result in falling into the three lower realms.""","","I said:","In this world, very few people indeed truly understand the difference between right views and wrong views.","However, enlightened ones know.","I would say, for example the view that the universe is a temporary composite body appears to make sense on the surface. However, it is still a wrong view.","Others may not know.","I know.","","Another example:","Most people will praise ascetics. Ascetic cultivators are often recognized by the world as having moral depth and being successful in their cultivation. In fact, this is also a wrong view.","Others may not know. I know.","","Another example:","In the past, my elders said to me that there is nothing after one's death. Heaven, hell, karma, retribution and reincarnation are all made up by religious leaders.","I heard this and knew right away that this is ""nihilism.""","The belief that there is nothing after death is ""nihilism.""","","Yet another example:","Someone said to me that he does not believe in anything other than ""money."" Only ""money"" is real.","Luxurious houses, prestigious cars, beautiful women, diamonds, jewels, fame and profit, status... are all attainable.","Everything is real.","We should enjoy life in this real world.","I heard this and knew right away that this is ""eternalism.""","Being attached to the material world and not letting go is ""eternalism.""","Both ""nihilism"" and ""eternalism"" are wrong views.","","* * *","","I, Living Buddha Lian-sheng, Sheng-Yen Lu, can criticize all cultivation practitioners. Why? Because I am enlightened.","In this world, if you have not reached enlightenment and you criticize others, it is then ""slander,"" and it is then pride and prejudice. The evil guiding the evil, the lost guiding the lost, and the blind guiding the blind, and all will go into the fiery pit.","However, if you are truly enlightened, you can criticize all cultivation practitioners. This is a way to guide them to attain unsurpassed and perfect enlightenment. It is a kind of lion's roar, a voice of justice, to awaken the masses so that they may attain ""right views.""","In fact:","""Eternalism"" and ""nihilism"" will lead to the three lower realms.","""Asceticism"" is a wrong view.","""The universe is a temporary composite body"" is a wrong view.…","In this world, there are many people who consider themselves learned, and they created a lot of ideas and theories.","These ideas and theories are based on ""wrong views.""","Now only those who are enlightened, are truly able to see through these ideas or theories using the ""wisdom of buddhas.""","If one has any doubts?","It seems, one can only ask ""me!""","","","","","W","","",""
"027 The Most Serious Samaya Precepts","https://reader.tbboyeh.org/fullscreen_player.php#/?ebook_id=1000542&chapter_id=c027","hite Tara said:","""Lian-sheng, Grandmaster Lu, you must explain the most serious samaya precepts. A cultivating practitioner who breaks any of these precepts will definitely fall into the three lower realms of hell, hungry ghosts, or animals. The extent of punishment would be ceaseless in both time and space. The agony is unimaginable - a billion times more painful than what one can experience in this world.""","""Why are these the most serious?""","White Tara said:","""The reason is because the people involved and circumstances are different, consequently resulting in the differences in severity. Grandmaster Lu, you must explain it.""","","Thus, here is my explanation:","The most severe transgression of killing -- is when you terminate the life of a cultivator who has unsurpassed and perfect enlightenment. As the life of this cultivator is invaluable, if you kill such a practitioner, it is equivalent to killing the wisdom-lives of hundreds of thousands of people.","(Killing a buddha or bodhisattva results in the most severe karmic retribution.)","","The most serious transgression of theft -- is stealing from a temple, a cultivation chapter, or a cultivation association. Transferring the ownership of a temple, a cultivation chapter, or a cultivation association to one's own name, embezzling money and property that does not belong to you.","(Or fraudulent fundraising under the pretext of building temples, cultivation chapters or associations, and then subsequently misappropriating the funds for one's personal gain and use; these are the most serious forms of theft.)","","The most severe transgression of sexual misconduct -- is when one seduces a monk or nun to violate their vows of celibacy. The resulting negative karma from this is much heavier than for people in general. If you force a bodhisattva to perform a sexual act with you, this also carries extremely heavy negative karma.","(In other words, the negative karma is doubled when one entices a cultivating practitioner to commit sexually immoral acts.)","","The most serious transgression of dishonest speech -- is when one deceives one's Root Guru, deceives one's teacher, and deceives the holy sangha. Committing an act of fraud against one's Root Guru for fame and status, fortune, and so on, in whatever way, will certainly result in one descending into Vajra Hell.","(It is useless and fruitless for one who deceives his/her Root Guru to carry out cultivation. This is due to the loss of lineage and blessing from one's Root Guru.)","","The most serious transgression of double-tongue -- is when one sows discord in the monastic community, and causes a schism within the Sangha. The Buddhist Sangha is the main group of cultivating practitioners, if you contrive to use divisive speech to sow discord and the Sangha is split asunder, the severe negative karma from this is the worst.","(The foremost example of this is Devadatta who betrayed the Buddha and caused a schism within the Sangha.)","","The most serious transgression of harsh speech -- is when one insults one's Root Guru with the most vicious and abusive words, or the filthiest speech. When one utters slander from only hearsay, from false rumors in circulation, or fictitious fabrications that one did not personally witness; the moment harsh speech arises, one has committed a grave sin. It is also a grave transgression when one uses abusive speech on a genuine cultivating practitioner.","","The most severe transgression of loose speech -- is when you disrupt other people's cultivation through meaningless idle gossip, or when you perturb the practice of a sincere cultivating practitioner or arhat through telling lewd jokes.","","The most severe form of greed -- is coveting money belonging to the Three Jewels (the Buddha, Dharma, and Sangha).","(For example, if one takes the monetary offerings intended for one's Root Guru, privately taking possession of it and flees. Or a treasurer of a temple, cultivation chapter, or association absconding with funds belonging to the cultivation venue. Or if one receives kickbacks from selling buddhist implements.)","","The worst evil thoughts -- are not wanting to leave the cycle of reincarnation, not wanting to liberate oneself from worries and afflictions, not wanting to attain self-mastery over life and death. Instead, your mind is filled with thoughts of worldly wrongdoings, especially the ""Five Deadly Sins"" or ""Five Heinous Crimes.""","","The most severe wrong views -- are slander against buddha-nature, slander against the wisdom of Tathagatas, slander against the Three Dharma Seals, slander against the teaching of One Ultimate Reality, slander against the Buddha, Dharma, Sangha, and slander against your Root Guru.","","White Tara said:","""Teachings regarding the precepts are of paramount importance, and they should be taught all the time.""","I asked:","""In the past, I have already explained them in my books. Do I still need to repeat them?""","White Tara answered:","""Precepts are the foundation of all dharma. It is necessary to repeat them time and again. If one breaks one's samaya precepts, not only will one be unable to reach accomplishment, but one will also fall into the three lower realms.""","","","","","","","","","","","","W","","",""
