"chaptername","chaptername href","chapterbody","chapterbody 2","chapterbody 3","chapterbody 4","chapterbody 5","chapterbody 6","chapterbody 7","chapterbody 8","chapterbody 9","chapterbody 10","chapterbody 11","chapterbody 12","chapterbody 13","chapterbody 14","chapterbody 15","chapterbody 16","chapterbody 17","chapterbody 18","chapterbody 19","chapterbody 20","chapterbody 21","chapterbody 22","chapterbody 23","chapterbody 24","chapterbody 25","chapterbody 26","chapterbody 27","chapterbody 28","chapterbody 29","chapterbody 30","chapterbody 31","chapterbody 32","chapterbody 33","chapterbody 34","chapterbody 35","chapterbody 36","chapterbody 37","chapterbody 38","chapterbody 39","chapterbody 40","chapterbody 41","chapterbody 42","chapterbody 43","chapterbody 44","chapterbody 45","chapterbody 46","chapterbody 47","chapterbody 48","chapterbody 49","chapterbody 50","firstcharacter","chapterbody 51","chapterbody 52","chapterbody 53"
"011 The Samaya Between a Buddhist Practitioner and Sentient Beings","https://reader.tbboyeh.org/fullscreen_player.php#/?ebook_id=1000542&chapter_id=c011","asked White Tara:","Is there samaya between a Buddhist practitioner and sentient beings?","White Tara replied:","Yes.","Has Grandmaster Lu heard of this following verse?","Especially with regard to great wise and kind friends, their fundamental purpose is to free sentient beings from the cycles of transmigration. Sentient beings should take refuge in great wise and kind friends, as they can guide one in cultivation through Buddha, Dharma, and Sangha.","It goes:","As long as the empty space exists,","It will surely be filled with earth, water, fire, wind, and emptiness.","As long as earth, water, fire, wind, and emptiness still exist,","It will definitely be filled with sentient beings.","As long as sentient beings still exist,","Emotions and desires, cravings, hatred, and delusions will definitely be present everywhere.","As long as these Five Poisons still exist,","The great compassion of spiritual cultivators will definitely be present everywhere.","Within this, there is even more samaya!","Oh Grandmaster Lu! Grandmaster Lu, this is the samaya between a Buddhist practitioner and sentient beings.","","I asked White Tara:","What kind of samaya does a Buddhist practitioner have towards sentient beings?","White Tara replied:","Like the sun, a Buddhist practitioner needs to light up the darkness of sentient beings.","Like one with clear vision, a Buddhist practitioner has to guide blind sentient beings.","Like one with great wealth, a Buddhist practitioner needs to relieve the poverty of sentient beings.","Like one who turns the dharma wheel, a Buddhist practitioner wants sentient beings to have spiritual refuge.","Like a teacher, a Buddhist practitioner wants sentient beings to learn Buddhadharma.","Like a vajra, a Buddhist practitioner has to protect sentient beings with their multitude of afflictions.","Like the great compassionate Guanyin, a Buddhist practitioner has to carry out the six paramitas of Buddhism, granting favors to sentient beings.","Like a bodhisattva, a Buddhist practitioner has to be able to benefit sentient beings.","Like Grandmaster Lu, a Buddhist practitioner has to not forsake a single sentient being, and teach Buddhadharma to all sentient beings equally and without discrimination, so that each and every sentient being can become a buddha.","This is samaya!","","* * *","","I asked White Tara:","Sentient beings are like the sea, able to keep a boat afloat, or capsize a boat. When sentient beings overturn the boat, what should a Buddhist practitioner do?","White Tara replied:","I will now teach practitioners how to cultivate; these are in fact turning points in a Buddhist practitioner's cultivation.","When sentient beings are poor,","this is the time and chance to teach Buddhist practitioners to ""give.""","When sentient beings insult you,","this is the time and chance to teach Buddhist practitioners to ""patiently endure.""","When sentient beings bully and oppress you,","this is the time and chance to teach Buddhist practitioners to ""progress with diligence.""","When sentient beings tempt Buddhist practitioners to commit bad deeds,","this is the time and chance to teach Buddhist practitioners to ""abide by the precepts.""","When sentient beings are blind, confused, and deluded,","this is the time and chance to teach Buddhist practitioners ""wisdom.""","When sentient beings are consumed by pipe dreams and wishful thinking,","this is the time and chance to teach Buddhist practitioners ""meditative stability.""","I","I, Grandmaster Lu, say this:","These are also samaya!",""
"012 The Samaya of Taking Refuge","https://reader.tbboyeh.org/fullscreen_player.php#/?ebook_id=1000542&chapter_id=c012","hite Tara asked:","""Grandmaster Lu! Do you know the samaya of taking refuge?""","I replied:","""Yes, it is written clearly on the certificate of taking refuge. After taking refuge in Buddha, one must not seek refuge in other gods or deities. After taking refuge in Dharma, one should learn Buddhadharma and not cause harm to any sentient being. After taking refuge in the Sangha, one should stop associating with heretics.""","","White Tara said:","""Grandmaster Lu! Do you know the true meaning of taking refuge?""","I said:","""Once one takes refuge in the Three Jewels, Buddha becomes one's great teacher, Dharma becomes one's path of cultivation, and the Sangha becomes one's dharma companion.""","I added:","""Finally, one attains buddhahood.""","White Tara said:","""What is Buddha, Dharma, and Sangha?""","I said:","""Buddha is the awakened one, fully enlightened, beyond compare, worthy of the highest honor. Dharma refers to the teachings that the Buddha handed down, and only this lineage of dharma teachings can bring an end to the reincarnation of sentient beings and their transmigration through life and death. As for the Sangha, they are keepers of dharma teachings and are our companions in cultivation. Hence, the Buddha, Dharma, and Sangha are our only object of refuge.""","","White Tara said:","""What you said is all correct. Then what is broken samaya?""","I said:","""After taking refuge, if one then goes and takes refuge in deviant paths, one's samaya becomes broken. After taking refuge, if one harms others, one's samaya becomes broken. After taking refuge, if one abandons the Three Jewels, one's samaya becomes broken. After taking refuge, if one gives up on cultivation because of worldly pursuits, one's samaya becomes broken. After taking refuge, if one disrespects the Buddha, Dharma, and Sangha, one's samaya becomes broken. After taking refuge, one must not abandon the Three Jewels regardless of the occurrences of favorable or adverse events.""","","White Tara asked:","""Do you take refuge only once?""","I answered:","""No. I take refuge all the time!""","White Tara asked:","""What do you mean by taking refuge all the time?""","I replied:","""This is a secret - every day I recite the Fourfold Refuge Mantra, think of the Three Jewels all the time, and reflect upon my refuge. I invoke the Three Jewels, pay great homage to the Three Jewels, make great offerings to the Three Jewels, praise the Three Jewels, and pray for the blessing of the Three Jewels, who are one's refuge all the way until buddhahood.""","White Tara said:","""This is the correct way of taking refuge!""","","White Tara asked:","""And who is your true refuge?""","I answered:","""This is highly secret. My true refuge, is self-refuge; refuge in my own buddha-nature.""","I added: ""I take refuge in the perfect and enlightened dharma body of buddha-nature; I take refuge in the superb and extraordinary tranquility of self-nature; I take refuge in all sages and saints who are of the same body, neither separate nor different.""","","White Tara then praised me:","Revered Lineage Root Guru,","By accomplishing your origin you become the yidam.","Bestowing dakinis with blessings,","Never departing from your three roots at all times.","","White Tara said:","You have ""seen"" and validated buddha-nature.","You have ""cultivated"" into the realm of meditation.","You have ""carried out"" one refuge.","This is already the highest level of taking refuge. Buddhahood and reincarnation are one; this is beyond the limits of any language, beyond the confines of any category; this is the unexcelled state of perfect enlightenment.","This is indeed:","W","","The most, most, most, most secret form of taking refuge.",""
"013 Do Enlightened Ones Have Samaya?","https://reader.tbboyeh.org/fullscreen_player.php#/?ebook_id=1000542&chapter_id=c013","hite Tara said:","""Enlightened buddhas also have samaya!""","I asked:","""What is the samaya of buddhas?""","White Tara replied:","""Great compassion, the wisdom of emptiness, unfettered ease, spontaneous accomplishment, perfection.""","","I asked:","""When a Buddhist practitioner has already become enlightened, does an enlightened one still have samaya?""","White Tara answered:","Yes.","An enlightened one completely understands ""the mind is buddha,"" ""buddha is mind,"" and ""one's mind is buddha."" The buddhas are not apart from oneself, one is not apart from buddhas. There is no difference between buddhas and oneself, the two are one.","Although enlightened ones already know that they are buddhas, they are still respectful towards their own Root Guru in whom they have taken refuge.","Rendering service.","Making offerings.","Paying homage.","Praying for the blessing of their Root Guru.","(This is the samaya between an enlightened one and their Root Guru.)","","An enlightened one has realized and understands that all phenomena arise from one's mind, and knows that when merit is not merit, it is indeed merit.","So-called merit is not having merit, and precisely because of the awareness that there is no merit, only then is it merit.","However, enlightened ones never stop accumulating the various causes and conditions of merit.","(This is the samaya between enlightened ones and merit.)","","An enlightened one is fearless about everything, for example regarding reincarnation, descending to the three lower realms, being in dangerous situations, and so on...","They are clearly aware that reincarnation is illusory, the three lower realms are a dream, and that dangerous situations are also temporary.","However, enlightened ones will abandon even the slightest misdeeds. They would not carry out negative actions no matter how insignificant they seem.","(This is the samaya between enlightened ones and negative actions.)","","Enlightened ones understand the unexcelled state of perfect enlightenment, and know that many pure lands are also born within oneself.","They know all of the dharma teachings pertaining to arhats, pratyekabuddhas, bodhisattvas, and buddhas.","They know the dharma teachings of Hinayana (Small Vehicle), Dviyana (Twofold Vehicle), Mahayana (Great Vehicle), and Vajrayana (Diamond Vehicle).","They know the dharma teachings of Great Perfection.","They know the dharma teachings pertaining to the Three Vehicles, Five Vehicles, and Nine Vehicles.","However, they do not disparage or vilify any of the dharma teachings.","(This is the samaya between enlightened ones and dharma teachings.)","","Enlightened ones have already validated and know about many kinds of samadhi states. They are able to enter into samadhi and have ascertained the existence of siddhi.","Enlightened ones have attained accomplishment on the path of spiritual cultivation. They have validated each of the Ten Bhumis (Ten Stages of Bodhisattvahood).","However,","They are not complacent.","They do not boast.","They are not arrogant.","(This is the samaya between enlightened ones and the actualization of the path.)","","Enlightened ones deeply understand the profound principle of equality without difference. They are fundamentally aware that there is no difference between oneself and others, no difference between oneself and sentient beings. I am a sentient being, and sentient beings are me. From the very beginning it has always been so; sentient beings and oneself are also a transient phenomenon.","However, enlightened ones cannot cease to have a great compassionate heart towards sentient beings.","(This is the samaya between enlightened ones and sentient beings.)","","Enlightened ones already understand that the two phenomena of reincarnation and nirvana are one in its nature and not two. Hence, samsara is nirvana, and nirvana is samsara; afflictions are bodhi, and bodhi is afflictions.","W","","However, enlightened ones never stop progressing along ""the path of cultivation.""","(This is the samaya between enlightened ones and cultivation.)"
"014 The Samaya of Diligence","https://reader.tbboyeh.org/fullscreen_player.php#/?ebook_id=1000542&chapter_id=c014","hite Tara said:","""Actual practice of Buddhadharma is diligent and unremitting, like the flowing water of a great river streaming continuously into the boundless sea.""","I said:","""Grandmaster Lu is number one in diligence.""","As a person, I don't really have any strong points. However, when it comes to perseverance, I would rank myself first.","Regarding writing, I write one article every day, unceasingly.","Regarding cultivation, I practice dharma every day, unceasingly.","Regarding painting, I paint a picture every day, unceasingly.","Regarding reading, I read every day, unceasingly.","Regarding samadhi, I practice meditation every day, unceasingly.","I said, ""No matter whether a Buddhist patriarch is of the Zen, Pure Land, Tantric, or Vinaya school, if I walk past their place of retreat, they would rise and applaud, Sheng-Yen Lu is number one in diligence.""","In fact, I am not a ""workaholic,"" I just abide in the luminosity of enlightenment and progress vividly, lucidly, and alertly.","I am merely completing my homework for each day!","White Tara said:","""To find someone like you in this world has now become very difficult!""","I replied:","""I am just doing my best, and I know nothing else.""","","White Tara said:","In this world, there are many Buddhist practitioners who, after reaching a particular meditation state, stop cultivating further and continue to stay permanently in that state. They do not know that such a meditation state is just temporary.","(This breaks the samaya of diligence.)","","For example:","When one practices qi, channels, and drops, one develops a craving for the sensation of great bliss arising from ""qi passing through channels,"" and ""inner fire passing through channels."" Such a sensation is indeed very mesmerizing, but this is only the blissful pleasure samadhi state of the Heaven of the Desire Realm.","If one becomes attached to this pleasure,","And ceases to progress,","Then one can only remain in the heavens of the Realm of Desire!","","Likewise:","From the samadhi of great bliss, a cultivator develops the ""samadhi of clear light"" where one's body, speech, and mind have reached the accomplishment of infinite light, illuminating heaven and earth. Subsequently, one believes that the ""samadhi of clear light"" is the end of cultivation. This is also a very mesmerizing state.","This is the samadhi state of the ""Heaven of the Realm of Form.""","If one becomes attached to clear light,","And does not think of progressing,","Then one can only remain in the heavens of the Realm of Form!","","Likewise:","From the ""samadhi of clear light,"" a cultivator develops ""emptiness,"" from clear light one enters the ""four realms of emptiness."" These samadhi states are: 1) infinity of space (akasanantya), 2) infinity of consciousness (vijñananantya), 3) nothingness (akiñcanya), and 4) neither thought nor non-thought (naivasaṃjñānasaṃjñā).","If one thinks that one has reached the end,","And does not think of progressing,","Then one can only remain in the heavens of the Realm of Formlessness!","","* * *","","White Tara said:","""These are all sensations arising from the accomplishment of great bliss. When one experiences these sensations of bliss, clear light, and emptiness, one ought to know that these are all temporary meditation states, and should not think that one is amazing and becomes complacent. If one thinks this way, one has broken the samaya of diligence!""","White Tara continued:","""Cultivators of the present age have neither attained nor validated the meditation states of bliss, clear light, and emptiness. Instead, they have attained the states of irritability, drowsiness, and sluggishness, and cease to progress any further. This is even worse than before.""","I said:","""When a yogi has cultivated to the state of non-cultivation, actually, even a yogi's non-cultivation is also cultivation.""","","W","","",""
"015 The Braggadocio Dharma King","https://reader.tbboyeh.org/fullscreen_player.php#/?ebook_id=1000542&chapter_id=c015","hite Tara said:","""There are many Buddhist practitioners, who have not yet attained but claim they have attained, who have not yet realized but claim they have realized; these are all grandiose exaggerations. Grandmaster Lu, you know that this is a violation of the precepts, these false overstatements break the samaya of speech!""","When I heard this, I sweated! Because in the Highly Confidential Register of Those Fallen into the Three Lower Realms, those who exaggerate and make false statements are far too many. Therefore, only by finding and following a master who has true virtue, will one be able to avoid falling easily into the clutches of mara.","","There is a ""Braggadocio Dharma King"" who is so extremely full of bluster and hot air, that it could be said, there was nothing he did not exaggerate. It was simply too much!","For instance:","The Braggadocio Dharma King said:","""Adi-buddha (the primordial buddha) manifested and called me his father. He paid homage to me, made offerings, and prayed for my blessing. Indeed, I am the unsurpassed buddha who has been in existence before him.""","(In fact, the Braggadocio Dharma King did not really know much about Buddhadharma.)","","The Braggadocio Dharma King said:","""My supernatural abilities are unexcelled, and the universe was created by me. With limitless spiritual power, the Five Dhyani Buddhas and even innumerable buddhas were all taught and trained by me so that they could become buddhas.""","(In fact, the Braggadocio Dharma King has never cultivated any dharma practices.)","","The Braggadocio Dharma King said:","""Grandmaster Lu is just a person with a little bit of supernatural power, and it was I who gave him empowerment. A mere puff of my breath, and he will die. He ought to come and take refuge in me. The reason he is still alive is due to my compassionate heart. After all, there is no need to overexert myself over something so effortless. With just one thought of mine, and he will enter nirvana!""","","The Braggadocio Dharma King said:","""Although Padmasambhava, Nagarjuna, Virupa, Naropa, and Tsongkhapa wished to become my disciples, I actually refused their requests. Their natural capacities are all too inferior, and I attained the fruition of buddhahood earlier than them. Unlike them, I did not need to practice meditation, and had already become buddha, whereas they all needed to practice meditation before they could become buddhas.""","(To be able to become a buddha without meditation is indeed strange!)","","The Braggadocio Dharma King said:","""I am one who does not need dharma lineage, as I am the origin of the lineage. Below me, masters of the Nyingma, Gelugpa, Kagyu, and Sakya sects are all my disciples and disciples' disciples. True Buddha School's Grandmaster Lu is a distant disciple of mine, and he ought to come and serve me.""","(To claim accomplishment in the absence of dharma lineage is an excessively grandiose exaggeration.)","","The Braggadocio Dharma King said:","""I am one who does not need Buddhadharma, as I am above Buddhadharma. I do not need Dharma teachings as that is only necessary for those with inferior capacities. I do not need to follow precepts, as I am above precepts. Since the very beginning, I have already attained liberation and enlightenment. Buddhadharma and precepts are all just garbage in my eyes.""","(No Buddhadharma, no precepts. Sutras, vinaya, and treatises are all rendered void by him!)","","The Braggadocio Dharma King said:","""Learn liberation from me, and you don't need to practice any dharma. You only need my blessing power, and you can quickly become a buddha. Even if you are in the three lower realms, if I call out your name, you will be liberated and become a buddha. As for hell, it is within the nail of my little finger, all I need is a mere snap of my fingers.""","","The Braggadocio Dharma King said:","""There is no need for the six paramitas, no need for effort and diligence. The key to accomplishment or not, is wholly dependent on me, the Dharma King. There is no need to go through tribulations. If I think about you, you will become liberated.""","","The Braggadocio Dharma King said:","""The path of liberation is just a name, the path of bodhi is just a name. What is real is my blessing empowerment.""","Oddly enough, while some people were stunned or taken aback by these claims of the Braggadocio Dharma King, there were also a group of others who actually believed him.","","However, real Buddhist practitioners must firmly remember:","Listen to Dharma teachings.","Understand Buddhadharma.","Practice Dharma with single-minded focus.","Obtain lineage empowerment.","Abide by and uphold precepts.","Cultivate meditation and validate enlightenment.","","","","","W","","",""
