"039 One Scene from “Bowl of Rice Cake Shop (Dian Kou Wan Guo)”","https://reader.tbboyeh.org/fullscreen_player.php#/?ebook_id=1000043&chapter_id=c039","t the end of November 2011, in an entourage of disciples that included Master Lianning, Master Liandian, Lianya, and Lianzeng, we ate rice cakes at the “Bowl of Rice Cake Shop” in the neighborhood of the National Taiwan Museum of Fine Arts in Taichung. The rice cakes of this Bowl of Rice Cake Shop were very popular, and every afternoon, it would always be packed with people. Most of the time, people had to make reservations before coming to have the rice cake!","","Hung on the wall of the Bowl of Rice Cake Shop were a painting and a calligraphy couplet that I admired. The painting in the center was Samantabhadra Bodhisattva riding on an elephant. The couplet, with one verse on each side of the painting, was written by the calligrapher, Lu Foting.","","The second verse of the couplet read, “Able in loving-kindness is my master.”","","I asked, “Who is the Able in loving-kindness?”","Lianning, Liandian, Lianya, Liandeng, and the rest, looked at one another, speechless.","","I said, “Able in loving-kindness is Shakyamuni Buddha.”","I explained:","","We chant the mantra of Shakyamuni Buddha:","","“Om, mou-ni, mou-ni, ma-ha-mou-ni, shi-jia-mou-ni, so-ha.”","“Mou-ni” in this mantra represents “Able in loving-kindness.”","","The explanation of the mantra is as follows:","","“The great teacher of the universal consciousness, able to carry out the path of loving-kindness; able to carry out the path of loving-kindness, able to carry out the path of great loving-kindness; the one who is able to carry out the path of loving-kindness of the Shakya clan, auspiciousness and perfection.”","","Therefore I said, “Able in loving-kindness is Shakyamuni Buddha.”","","While I was explaining, two ladies came in through the entrance of the shop. Both of them waved at me, and said, “We are your disciples!”","","One of the disciples said, “About several months ago, we met while Grand Master Lu and fellow disciples were eating rice cakes at ‘Bowl of Rice Cake Shop.’ I kneeled down and prayed for Grand Master’s blessing. It was because I had been married for eleven years, but I could not get pregnant. I had seen lots of famous doctors of Traditional Chinese and Western medicines, but the results were still negative. Knowing that Grand Master Lu has great dharma power, I therefore prayed for great blessing.”","","The disciple continued saying, “At that time, Grand Master Lu stood up to bless me on the head. Through Grand Master’s palm on my top of my head, I could feel the dharma stream coursing down my whole body continuously without stopping, there was an expanse of brightness in front of my eyes. Subsequently, after I went home, I became pregnant. I am truly thankful to Grand Master Lu. Now, I am praying for a safe delivery for me and my child.”","","I finally remembered:","","This lady disciple, several months ago, had kneeled in front of me, praying for “pregnancy” blessing. The reason was, she had been married for eleven years but was infertile.","","I closed my eyes, and saw the Samantabhadra Bodhisattva on the wall radiate light which entered into the womb of the lady disciple.","Wow! The response in my hand was very strong. That kind of vibration power was generated from the union of the Bodhisattva with my hand.","Inside the light that entered into the womb of the lady disciple, there was a small child.","","At last, a few months later. She was pregnant!","","I told the lady disciple, “This child will be a great sage in the future!”","","Everyone in the Bowl of Rice Cake Shop saw this scene.","","And:","","There was a disciple who lived very far away overseas; she had been infertile for twenty years. Twenty years, plus twenty years [of age] before marriage—she was already forty years of age; would it be possible for her to give birth?","","She did not give up. She prayed to the Padmakumara statue and prepared the greatest offerings. That night, she saw Padmakumara dressed in white robe, extraordinarily dignified, and wearing a Five Buddha Crown. There were five colors of precious jewels on the crown. Amongst them, a red precious jewel fell onto the hand of Padmakumara that immediately transformed into an exquisite cute little baby.","","Padmakumara said to the lady disciple, “This baby is given to you!”","In her dream, her belly became large. When she woke up, she told her husband that she had a baby in her belly.","A","Her husband replied, “Thoughts in the daytime may get reflected in dreams at night. How can dreams be accurate?”","","Now, her parents-in-law all took refuge, and so did her relatives and friends. Many people took refuge. All just because one dream led to a pregnancy!","","","","","","","","","But, since that day, the lady disciple really became pregnant.","","","","","","","",""
"040 I Will Take You to Fly","https://reader.tbboyeh.org/fullscreen_player.php#/?ebook_id=1000043&chapter_id=c040","n Saturday, December 10, 2011, I was in Taiwan Lei Tsang Temple presiding over the “Treasure Source Tara” homa ceremony. On that day, over ten thousand people attended and listened to my exposition of the origination of Treasure Source Tara.","","After the dharma talk, I also bestowed the empowerment of “Treasure Source Tara” to the crowd. During the empowerment, I had a special sensation.","","Treasure Source Tara appeared in gold from the space; her appearance was similar to “Green Tara.” She flew freely above the empowerment banner and her flying postures were not like a flying bird, but rather in various standing or sitting postures. One hand formed the wish-granting mudra and the other hand was holding an “Utpala flower.” Different kinds of light emanated from her ten finger tips and the Utpala flower.","","Within the lights were lots of treasures:","","Lotus flowers","Jeweled carts","Golden lamps","Auspicious fruits","Incense oils (Vilepana)","Dharma wheels","Water with eight merits","Fragrant flowers","Buddha-fruit","Sublime bliss","Flying shoes","Etc…","","Limitless seven treasures, eight treasures, twenty-one treasures, thirty-two treasures, and thirty-seven treasures, continuously descended from the space onto all disciples; even I, Living Buddha Sheng-yen Lu, also received one treasure, “Flying shoes.” I picked them up, and kept them close to my chest.","","Treasure Source Tara asked me, “Grand Master Lu, you already can fly, what is the benefit of having the flying shoes?”","","I replied, “I will bring someone with me to fly.”","","Treasure Source Tara asked, “Fly to where?”","","I replied, “Fly to the pure land of Maha Twin Lotus Ponds.”","","Treasure Source Tara said, “Why not fly to the pure land of Samantabhadra Buddha Mother, which is the origin of Treasure Source Tara.”","","I answered, “Buddha pure lands are all interconnected, I certainly will make offerings to the pure land of Samantabhadra Buddha Mother.”","","Treasure Source Tara said, “Excellent! Excellent!”","","After the ceremony, a disciple asked me, “Grand Master Lu, I heard that you could spiritually travel to the Buddha worlds of the ten directions, right?”","","I replied, “I can fly.”","","Disciple asked, “Can you take me to fly?”","","I suddenly remembered that in my chest I had the “flying shoes” bestowed by Treasure Source Tara. I thought, what a coincidence that a disciple had asked.","","I replied, “I will take you to fly!”","","Disciple asked, “When?”","","I answered, “Tonight.”","","O","","“Last night, I really flew. Grand Master Lu took me to fly. We flew over a big mountain and a big sea. We flew across the starry sky, and to Maha Twin Lotus Ponds to see all the Padmakumaras of different colors.","","That kind of flying was actually very unusual. As long as both arms were stretched upwards and the feet were stepped off [from the ground], then one could fly comfortably. The body was like a falling leaf, as if in an illusion or in a dream.”","","","I said, “Of course it was real.”","","●","","","And then we flew into the center of the lotus pistil of a lotus flower in Maha Twin Lotus Ponds, and flew to the pure land of Samantabhadra Buddha Mother. We saw Samantabhadra Buddha Mother, Nairatmya, Vajravarahi, White Tara, Green Tara and all the Buddha Mothers.","He said, “Grand Master Lu, you took me to fly, it was so real!”","Alas! Time passes really quickly!","Sheng-yen Lu","The next day, December 11, 2011, I was at “Gan Lu Ching Tze Temple” conducting “Yogacara Ulka-mukha.” That disciple also attended, and he told me:","","","",""
"041 Cao Cangming Thus Said","https://reader.tbboyeh.org/fullscreen_player.php#/?ebook_id=1000043&chapter_id=c041","n December 10, 2011, after the “Treasure Source Tara” homa (fire offering) ceremony was completed at around six o’clock in the evening, I went to have my dinner at the dining hall of Taiwan Lei Tsang Temple.","A Mr. Cao Cangming was sitting next to me, at my right.","","He said, “I knew Grand Master Lu over thirty years ago.”","","I was startled. I asked, “How old were you at that time?”","","He answered, “At that time, I was studying primary school.” (Dharma brother was now over forty years old.)","","I asked, “How did you know me while studying primary school?”","","He answered, “My mother brought me to see you to ask about my father. The location was at Jinhua Road. I felt that Grand Master Lu could really tell jokes. When adults listened to you, they laughed heartily!”","","He said, “During that time, my father, who was serving at the police force, was the head of the local police station near Deji Reservoir. He and Grand Master Lu’s father, Lu Ershun, had frequent contact with each other. My father frequently chatted with Grand Master’s father. They were very close. And also because of this, my father and mother were able to visit Grand Master Lu.”","","He said, “Grand Master Lu’s divination is really accurate!”","","I asked, “How accurate is it?”","","He answered, “My father was investigating a criminal case, and came seeking Grand Master Lu for instructions. Grand Master Lu had said, at a certain time and month, he would be able to capture this criminal by going to Yanchao Township in Kaohsiung City.”","","“The result?”","","He said, “The result was, he really caught the criminal! Due to this achievement, my father was transferred from Taichung County to Taichung City. Eventually, my father became a Senior Inspector and he remained so until he retired.”","","He also said, “Grand Master Lu’s divination for my uncle is the most accurate.”","","“How so?”","","He said, “Grand Master Lu asserted that my uncle could become the Chief Inspector in the police force, and my uncle really did become the Chief Inspector. Grandmaster also told my uncle to be careful at fifty years old.”","","“The result?”","","He said, “At age fifty, he unexpectedly died of a heart attack!”","","I asked, “I did not say that he would die, did I?”","","He said, “You did not. Grand Master Lu only said, to be careful at age fifty.”","","He also said, “When my uncle became Chief Inspector, and died at age fifty of a heart attack, it was considered quite sensational. The news media even published it.”","","Cao Cangming said, “At that time, Grand Master Lu was at Taichung giving consultations. It created quite a stir. You were surrounded by many people everyday. My whole family came to ask Grand Master Lu for guidance—my father, mother, aunt, and uncle. The most accurate was the capture of the criminal, and the death of my uncle at age fifty.","Even the time, place, and age, was without deviation.”","","I asked, “Has your father ever come to Taiwan Lei Tsang Temple?”","","“He came before. He had always wanted to acknowledge the old relationship with Grand Master Lu’s father. It was just that your father, maybe, had forgotten him. When he knew old Mr. Lu Ershun had passed away, my father, in those days, was grief-stricken. He was continuously silent and not speaking!”","","“Alas! Time passes really quickly! Hard to imagine that I am already sixty-seven years old, and you are also over forty. When I was giving consultation, I was only over twenty years old, and you were only in primary school.”","","There is one saying:","O","“Human life is a live broadcast. Furthermore, there are no NGs”","","●","","Buddhadharma does not part from secular dharma. This is how it is!","Sheng-yen Lu","","","","","","","","","","","","","",""
"042 “Lotus Leaf Child” Sadhana","https://reader.tbboyeh.org/fullscreen_player.php#/?ebook_id=1000043&chapter_id=c042","here was once a Buddhist layperson who enjoyed a great reputation in the Buddhist community. He knew both Vajrayana and Sutrayana very well. This great layperson was also a rich and powerful person. He donated money to build temples, to print sutras, to offer to the Sangha, and to do good deeds. In the religious community, everyone knew about him.","","When he was living abroad in New York, he printed a sutra. Very few people know about this sutra. It was not widely circulated. The sutra is called Lotus Leaf Child Sutra. I came across this sutra by accident.","In the sutra, it teaches people that offering to the “Lotus Leaf Child” has great benefits:","","1. Increase in fortune.","2. Improvement in wisdom.","3. Great power and prestige.","4. Great supernatural powers.","5. Extension of life.","","The statue of “Lotus Leaf Child” can be made using wood, porcelain, glass, clay, or stone. A model of a child standing on a lotus leaf is molded; the hair is tied into two buns on top of the head. The child can be male or female.","","One head, two arms. The two hands, each extending an index finger. One finger pointing at the earth, the other pointing to the heavens.","(Similar to the child statue of Shakyamuni Buddha of the Buddha Bathing Festival.)","","The difference between this statue and that of the child statue of Shakyamuni Buddha is the standing on the lotus leaf and also the two hair buns on top of the head.","","The offering sadhana in the sutra is:","","Offering is to be done in a private room. (Chickens, dogs, cats, and the like, are not allowed to enter.)","","Offerings are flowers, incense, light, tea, fruits, children’s toys, and candies, etc.","","Incense is to be lit three times a day: morning, noon, and night.","","Cultivation practice is to be done in the afternoon.","","Visualize “Lotus Leaf Child.”","","Chant: (Mudra: one hand pointing to the heaven, one hand pointing to the earth.)","","“Heaven Spirit, Earth Spirit, Lotus Leaf Child Spirit. Ji-ji-lu-ling. Seh.” (The more the better)","","Entering of the Principal Deity into Oneself (Ru-wo) and Release of Oneself into the Cosmic Consciousness (Wo-ru). (Similar to entering samadhi.)","","The above is the essential part of the sadhana. The others like paying homage, making offerings, making wishes, etc., are done according to one’s abilities.","","In this way, it can be done once a day or three times a day, depending on each person’s preference, but it should not be interrupted.","","One needs to chant until “Lotus Leaf Child” appears in one’s own dream before it is then considered to be “yogic response.”","","The pith instructions:","","The cultivator has to eat the offerings.","If the offerings have spoiled, it should be discarded and changed to fresh ones.","","The essence:","","Sincerity","Dedication","T","After yogic union, “Lotus Leaf Child” will stand by you like a shadow. If the cultivator were to pray to Lotus Leaf Child for wealth, wealth will then come; if one were to pray for fame and status, fame and status then follows; if one were to pray for children, children will then come; if one were to pray for a boyfriend or girlfriend, a boyfriend or girlfriend will then come; if one were to pray for marriage, marriage will then come; if one were to pray for an exam, the performance on the exam will be good; if one were to pray for food and drink, food and drink will follow.","","","After yogic union, Lotus Leaf Child can “respond to you in a dream,” that is, he will inform about auspiciousness, ominousness, calamity, fortune, and so on.","","","The “Lotus Leaf Child,” I categorize him in a list of “gods” that everyone can pray to and worship.","","A Buddhist, of course, does not have to cultivate the “Lotus Leaf Child” Practice. But, if they have the supernormal powers of “Lotus Leaf Child,” it would certainly be an assisting force to learning Buddhism.","","There are indeed various gods of all heavens.","After yogic union, if one were to pray for wisdom of the Buddha, one will have clear understanding when reading scriptures; if one were to pray for various deities, various deities will appear; if one were to pray for wisdom to grow, wisdom will then grow; if one were to pray for supernatural powers, supernatural powers will also appear.","Grand Master Lu hereto tells everyone, the “Lotus Leaf Child” Sadhana is similar to the “Child Reporting to the Ear” Practice, but it is a bit more superior.","There are indeed buddhas and bodhisattvas.","There are indeed dakinis.","","There is indeed “Lotus Leaf Child.”","This is truly present in the secular world. Buddhadharma does not part from secular dharma. This is how it is!","",""
"043 Letting You Know Through Your “Dream”","https://reader.tbboyeh.org/fullscreen_player.php#/?ebook_id=1000043&chapter_id=c043","","ne True Buddha School disciple, “Lianhua Changyu,” who was about fifty years old, and his wife, Mrs. Chen Ting, were invited to participate in a pilgrimage group of a nearby temple. They travel to an ancestral shrine for their pilgrimage.","","The pilgrimage is a popular custom in Taiwan. For instance, every year, the Goddess Mazu is lifted in a sedan chair at Zhenlan Palace in Dajia to Fengtian Palace in Xingang.","","This temple event can be considered number one in the whole province. They are number one in having the most people, welcoming Mazu, receiving Mazu, participating in the procession, burning incense, etc...","","In Dajia’s Mazu Parade, besides Mazu, there are still Qian Li Yan (the General of Thousand Mile Sight), Shun Feng Er (the General of Brilliant Hearing), and various deities following. The leaders of the parade are quite many.","","Central senior officials, regional senior officials, and a very large number of worshippers, stir up a commotion along the way. It can be said that this is a very grand occasion for the entire country.","","This Mazu Mania of Taiwan during the third lunar month is not a small affair.","","As for:","","It goes without saying that there are so many temples of all sizes in the whole province of Taiwan, as well as deities, that it is practically impossible to count them all.","","With the buses of the pilgrimage groups going here and there, tides of people going to the temple event, and the Ba Jia Jiang (bodyguards and attendants), Taiwan has become a believer of a diverse array of religious customs.","","The pilgrimage group that “Lianhua Changyu” and his wife participated in was scheduled to start their journey.","","On the night before they were to start their journey, they each had a dream.","","Grand Master Lu appeared in their dream, and told them, “Do not go tomorrow!”","","“Why?”","","“There will be a motor vehicle accident!”","","“In the vehicle are statues of Third Prince, Mazu, City God, Wang Ye, etc… Many deities are on the vehicle protecting it. There should not be anything happening.”","","Grand Master Lu said, “The calamity is inevitable!”","","The husband and wife saw Grand Master Lu’s warning in their dream at the same time. As a result, they were hesitating and could not decide on whether or not to go.","","However, Lianhua Changyu was one of the group leaders, and also one of the leaders of the vicinity. If the leader were to play truant, how was he going to explain; the pilgrimage group was also suggested by the vicinity’s elders. If they do not go, they would be letting down these elders.","","Cancelling was also not possible.","","They could only summon up courage and participate. They were thinking that it was only a dream and dreams were not necessarily real.","","At the end, their only solution was to wear a “Padmakumara” protection amulet on their bodies. The pilgrimage group set off as planned.","","The whole bus journey went without a hitch. There were altogether three buses following one another. Lianhua Changyu was originally riding on the first bus, but was later switched to ride on the second bus. The pilgrimage also went very smoothly.","","On their return journey, at Alishan, while they were on the turning point at the mid-height of the mountain, the brakes of the first bus suddenly failed.","","As a result, the bus crashed against the road barrier and overturned. The impact caused it to dash out towards the slope. The car laid on its side at the roadside.","","Heavens! It really was a motor vehicle accident!","","O","","Of the worshippers on the bus, one person died and seventeen people suffered severe injuries. They were admitted to the local hospital.","Finally—","","Lianhua Changyu said:","He was supposed to ride on the first bus. On the return trip, he boarded the first bus, and found that his seat was already taken by another person. The person sitting there had said, “No need to change seats, just sit in my seat on the second bus.” Subsequently, Lianhua Changyu and even his wife, were then allocated to the second bus.","","The problem was, the person who had switched seats with Lianhua Changyu, was the very one person who died in the motor vehicle accident.","","Heavens, how could this be?","Was it fate?","","","Had Lianhua Changyu not switched seats, would he be the one who died?","Was it coincidence?","The police and ambulance all arrived!","Was it the effect of the protection amulet?","Lianhua Changyu said, “When the pilgrimage group was on the road on Alishan, while spiraling downwards, we smelled waves of incense fragrance. Was it Padmakumara protecting? But, why did he not protect the people on the first bus?”","",""
