"023 White Lotuses Emanate from My Mouth","https://reader.tbboyeh.org/fullscreen_player.php#/?ebook_id=1000043&chapter_id=c023","ne day, as I passed by a large monastery, the sound of sutra recitation wafted from it, and so with curiosity, I went in.","","The monastery was actually holding a ceremony. In the center, there was one person who had a shaved head and he wore a yellow cassock with a red precept robe on the outside.","","Surrounding him were two rows of female lay Buddhists wearing black Haiqing robes and each of them was holding a sutra for recitation.","","Behind the black Haiqing robes, there was a group of believers, not too many of them; but, they filled up the whole main hall.","","I listened carefully to the scriptures of the sutra, it was the “Avalokitesvara Bodhisattva Pu Men Pin,” a chapter within the [The Saddharmapundarīka Sutra] (The Lotus Sutra).","","The believers who were reciting and praying were very pious. Their heads were lowered; only the sound of sutra reciting was heard. There was no other sound.","","There were three golden statues in the main hall and they were:","","Fundamental Teacher Shakyamuni Buddha in the middle.","Medicine Vaidurya Light King Buddha on the right side.","Amitabha Buddha on the left side.","Skanda and Sangharama Dharmapalas at the left and right.","","On the offering table, there was also another statue, “Avalokitesvara in Royal Ease Posture,” that was made with vaidurya glass. This Avalokitesvara statue had the blue and green colors mixed together. It was very dignified and pretty. It carried the Goddess’ merciful light which was as vast as a big ocean.","","Just at that moment, I heard a sound:","","“Grand Master Lu, you can recite as well.”","","I searched and found the source of the sound. Wow! The Avalokitesvara Bodhisattva on the offering table had already transformed and enlarged to fill up the whole main hall, like the blowing-bubbles - transparent and colorful, both illusory and real,.","","I asked, “Recite which sutra?”","","The Bodhisattva said, “Recite along.”","","I said, “Oh Bodhisattva! I have learned Pu Men Pin before, and I am able to sing and recite, but as I do not have the sutra text with me today, how can I recite it? I know High King Avalokitesvara Sutra and I know it by heart; I will just recite High King Sutra then!”","","The Bodhisattva nodded.","","I also asked, “Where do I recite the sutra?”","","The Bodhisattva said, “You go to the right wing. There is a little library and nobody is in there at this moment. You can sit in the library and recite the sutra!”","","I asked, “To whom shall I recite?”","","The Bodhisattva answered, “You will know.”","","I asked, “How many times should I recite the sutra?”","","The Bodhisattva replied, “A hundred times.”","","I said, “A hundred times? You want me to recite until my mouth is dried and lips are burnt, and I have not had lunch yet! Please forgive me! Reciting for twenty times is good enough!”","","The Bodhisattva did not reply, and disappeared with a smile.","","O","","During the time of reciting, I paid no attention to people who came in; even if people questioned me, I would not answer. I only wanted to complete this arduous task of reciting as soon as possible. I heard someone say, “This person is mumbling in his mouth, he could be insane.” But, no one kicked me away. I was silently moaning about the hardship in my mind.","That night, I slept.","","I saw one hundred people kneeling in front of my bed.","I asked, “What are you doing? What are you doing?”","","The hundred people said, “Many thanks to Grand Master Lu for delivering the one hundred of us from the sea of bitterness of the netherworld.”","","“What?”","The hundred people replied, “Each time Grand Master Lu recited the sutra, one white lotus emanated from your mouth. We rode on the lotuses and left the sea of bitterness!”","","","","","On that day, I quietened my mind and recited High King Sutra for a hundred times. Even though each High King Sutra is short, reciting a hundred times would take a rather long time. I sat in the library for a total of six hours in order to complete reciting a hundred times. (Five minutes was taken for each time; the more I recited the faster it went.)","●","I felt deep veneration for him and immediately protected him for his trip to take up the new post.","Sheng-yen Lu",""
"024 Forensic Doctor Yang Risong","https://reader.tbboyeh.org/fullscreen_player.php#/?ebook_id=1000043&chapter_id=c024","n the evening of the 23rd of November 2011, I saw a person come to the front of my bed in my dream. This person was wearing yellow khaki pants and a white top. He had sparse salt and pepper hair. His face was quite slim and angular. As I could not recognize him, I asked him, “Who are you?”","","He answered, “Yang Risong.”","","I said, “Yang Risong? The name sounds familiar, but I still do not know who you are.”","","He replied, “Forensic Doctor Yang Risong.”","","At this time I quickly remembered. Forensic Doctor Yang Risong, a famous autopsy expert in the Ministry of Justice, is very well-known. There were lots of rumors about him, and he had exposed the truth of many mysterious cases.","","I asked, “May I know why you are looking for me?”","","He replied, “I need you to accompany me on my journey!”","","“What happened to you?”","","“Died!”","","“What was the illness?”","","“Colorectal cancer.”","","I asked, “Why do you need me to accompany you?”","","He replied, “I have to go to Japan to take up a new post, and have to pass over the ocean, but there are karmic creditors in the ocean who will hinder me. I need to rely on Grand Master Lu’s Buddhadharma for protection. You know that when I saved one party, the other party would surely be offended. I was a forensic doctor, and naturally these kinds of things will happen.”","","“Why do you go to Japan?”","","He replied, “I have affinity with Japan. I am taking the position of City God Territory Master in Japan.”","","I felt deep veneration for him and immediately protected him for his trip to take up the new post.","","Forensic Doctor Yang Risong of Taiwan actually became the City God Territory Master of Japan.","","Along the way, even though there were resentful spirits, all were just unreasonable disturbances. I protected Yang Risong using three lights, and not even one thing happened.","","Yang Risong said, “Once, after examining a corpse and determining that it was suicidal; on the way home, the deceased’s spirit rushed to pat my shoulder. I immediately returned to examine the corpse again, and I actually identified a suspicious point, and finally confirmed it to be homicidal. This was a tricky homicidal case, and it was purposely misrepresented as suicidal. If the corpse was not carefully inspected, one would not be able to tell otherwise.”","","Yang Risong said, “I was the confidential secretary of Lord Yama in my previous life, and therefore I was born in this human world as a forensic doctor. Lord Yama once even invited me for dinner!”","","Yang Risong said, “There was another time when I was examining a person who committed suicide by lying across railway tracks. The initial diagnosis was suicide on the railway tracks. Later on, when it was discovered that the deceased spirit was chasing the train for taking his life, I then realized that it was another homicidal case.”","","I asked, “You can see as well?”","","He replied, “I can see, there are gods and spirits.”","","I asked, “Any wrongly accused?”","","He replied, “Certainly, but then, as there are gods and spirits, there will not be any mistakes. A forensic doctor’s responsibility is really heavy.”","","I asked, “You got the disease of livor mortis [purplish red discoloration of the skin]?”","O","He replied, “I had too much contact with the corpses, and got infected.”","","","I accompanied Yang Risong on his journey, and walked for a long distance. When I woke up, I was actually still in my bed.","","","Garuda received Buddha’s edict and became one of Buddhism’s protectors.","","Sheng-yen Lu","","","When Yang Risong arrived at the Japanese territory, his whole person was completely changed — he wore a big red robe and a crown. His facial features also changed to rounded appearance and a look of righteousness permeated.","●","","","","","","",""
"025 The God Garuda","https://reader.tbboyeh.org/fullscreen_player.php#/?ebook_id=1000043&chapter_id=c025","ia Lou Da (Garuda), is the Sanskrit name of this God and it has been translated to different Chinese names like “Jia Liu Luo,” “Jia Lou Luo,” “Jia Luo Luo,” “Golden-Winged Bird,” “Wonderful-Winged Bird,” “Great Peng Golden-Winged Bird,” and so on.","","This God in Hinduism has limitless power; it is a very fierce big bird, and is the mount of “Lord Vishnu.”","","The bird form Garuda.","Angry eyes.","Sharp beak.","Both claws grasping various dragons.","The wings are made from different treasures.","Both wingspan stretch to several thousand miles long.","","Legend has it that:","","When the wings move, it can raise a typhoon.","The thrones of various Gods vibrate.","Garudas eat dragons as their food.","The emblem of Indonesia is “Garuda” — it is their national symbol. It originated from Hinduism’s Great Roc Golden-Winged Bird.","","The mantra of this God:","","“Om, jia-xi-bo, so-ha.”","","Mudra:","","The thumbs of both hands are crossed, the remaining four fingers form wings facing outward and wave three times like flying.","","●","","When Shakyamuni Buddha was living in this world, the “Naga” dragon family begged the Buddha, “Our Dragon family is already going to be eaten up by Garuda, we pray to Buddha to save our lives!”","","Therefore, Buddha summoned Garuda and the dragon family to have a reconciliatory meeting.","","Garuda said, “If we do not eat dragons, what else can we eat?”","","The dragons were scared to death after hearing that. The dragon family said, “If you continue eating us, the dragon population will be exterminated, and then, what can the Garuda race eat in the future?”","","Once these words came out, Garuda was stunned.","","Therefore, Buddha said, “Starting from today, I will grant an edict to all Buddhist disciples. When performing the vast nectar transformation into food, Garuda will be the first one to be invoked to eat the cloud-like nectar, and this nectar is tasty, filling, and purifying. What do you think?”","","Garuda was very satisfied after eating it. Thereupon, the three parties came to an agreement. Garuda then did not eat the dragon family, and switched to eating the “cloud-like nectar.”","","Garuda received Buddha’s edict and became one of Buddhism’s protectors.","","The sharp beak could expel the devils.","The claws could seize devils.","The wings could stir up the devils’ throne.","The golden wings could grant fortune to sentient beings because they are made with seven precious jewels.","","When Grand Master Lu performs the noon-time offering of transforming nectar into food:","","J","","Great Peng Golden-Winged Bird","Raksasa and Hariti","All filled up with nectar","Om, mu-di-li, so-ha. Om, mu-di-li, so-ha. Om, mu-di-li, so-ha.","Sprinkle the nectar outwards.","","There was one time, I saw the sun was suddenly covered up. The sky turned grey and the earth became dark, and a whirlwind ensued. I was greatly startled by the instant change.","","I closed my eyes, unable to open them. When I opened my eyes, the sun was bright in the sky, and there was no sign of strong wind. What happened to the bright sun that was covered up?","I asked the spirit officer on duty.","All the ghosts and spirits of the wilderness","","","","The recitation is:","The spirit officer on duty replied, “It was the arrival of Garuda.”","The first time my mother, Lu Yunu, made offerings to Garuda, she was given a ride by Garuda to tour the world. She was exhilarated.","Garuda has the great transcendental ability of going anywhere at will and traveling around the world at only a single thought!","●"
"026 Dongyue Emperor (Dongyue Dadi)","https://reader.tbboyeh.org/fullscreen_player.php#/?ebook_id=1000043&chapter_id=c026","disciple by the surname Han came from overseas to Taiwan Lei Tsang Temple to see me. He handed me a piece of paper filled up with written simplified Chinese words. Its content was as follows:","","Disciple Han, divorced and was raising three children. After the divorce, he received two million American dollars.","","He had a very close friend. This friend and his wife ran a jewelry business and had several shops. This couple were not only friends to him, but were former classmates and neighbors as well. They were very good friends who would frequently travel or have meals together and have heart-to-heart talks. Their friendship spanned more than thirty years.","","The couple wanted to open another shop and invited him to join the partnership. He joyfully agreed, and by way of “lending,” gave the two million American dollars to this couple with whom he had thirty years of friendship. In the first couple of years, interests were given to him.","","Later on, interest had to be temporarily owed; as owing accumulated, they decided to stay away. After chasing them several times for repayment, it ended with no results. Without any clues, he resorted to hire a lawyer to serve them a legal letter to claim what they owed.","","From then on, the couple broke off contact with disciple Han. Even meeting up with them was impossible. (The couple simply moved out.)","Disciple Han sorrowfully related to me that he had sunk into dire straits. He could not afford living expenses, as well as his three children’s living and education expenses.","","He said, “I had never doubted him as we had thirty years of friendship. He did not even write an IOU. The only evidence was the original cheque. But now, my family financial situation is getting very tight, and I do not know how to deal with it?”","","I was quite deeply moved after I heard this. I said, “You have to discuss with your lawyer regarding any legal questions. The lawyer has more legal knowledge in this aspect. As for my part, I will draw a talisman and give it to you. This is a talisman for claiming debts. You take the talisman and together with joss paper, burn them at the Earth Deity temple in the afternoon of a “Success” day. It may help.”","","The talisman style that I drew was as follows:","","","","According to what I understood:","Once the Earth Wealth Deity received the decree, he would not dare to disregard it because it was assigned by Grand Master Lu to take the decree to the temple of Dongyue Emperor.","","Dongyue Emperor was furious, “Ox-Head and Horse-Face, quickly arrest the souls of the couple here!”","","Then this couple, both simultaneously dreamed of “Ox-Head” and “Horse-Face,” who in possession of arrest warrants, brought the couple to Dongyue Emperor.","","Dongyue Emperor was as awe-inspiring as the mountain; he had a black face, round and wide-opened eyes. He was so powerful and stern-looking that people dared not look closely. The couple knelt down.","","In the surrounding were ghost kings, ghost soldiers, Ox-Head, Horse-Face, Seventh Lord, and Eighth Lord, each carrying an instrument of torture, scaring the couple to death.","","Dongyue Emperor roared out loudly, like the thunder in the sky. This couple immediately knocked their foreheads to the ground continuously like pounding garlic. Instantly, they confessed the whole matter.","","Dongyue Emperor said, “After returning to the living world, you have to immediately return both principal and interest. Otherwise, you will be punished to the Great Avici Hell.”","","The jailer took the couple to see the Great Avici Hell. They were so scared that they were trembling with fear and screamed continuously.","They kept saying, “We will not dare to do it again!”","","The couple had the same dream and woke up at the same time with their whole bodies trembling in cold sweat. Thereupon, they quickly calculated the total amount of two million American dollars with interest, and delivered it to disciple Han on the same night.","","The couple personally told disciple Han this matter, and disciple Han in return recommended them to promptly take refuge from Grand Master Lu because Grand Master Lu really has immeasurable spiritual power.","","Disciple Han asked, “Who is Dongyue Emperor?”","","I answered, “A great ruler deity in the Netherworld. He is the same as the Emperor of Mount Tai.”","","This matter happened on November 26, 2011.","","","","A","","","","","","","","","","","","","","","","","","","",""
"027 The Answer from Heaven","https://reader.tbboyeh.org/fullscreen_player.php#/?ebook_id=1000043&chapter_id=c027","had written a book and its name was [Divination to Wow You]. This book was not meant to brag. Exactly how accurate was it? It was good enough as long as you, I, and he knew. It was actually not necessary to brag.","Mr. Zeng Haitang of Zhong Tian television program division raised his big thumb and said, “Really accurate!”","But worldly people are always boastful and arrogant. Nowadays it is rather difficult to find someone who is humble.","●","All the worldly people are:","","All the articles in the world belong to Sanjiang.","Sanjiang’s articles belong to my village.","My village’s articles belong to my brother.","My brother learned about writing articles from me.","","Anyway, all modern divinators always claim that they are number one, and other people are number two. Are they accurate? Heaven knows.","","Someone asked me, “Regarding the presidential election, do you know who will be elected?” (Dong suan - A term frequently used in Taiwan during election. Its meaning is “Electoral Victory”)","","I answered, “I know.”","","“Are you ironclad accurate?”","","“Accurate!”","","People asked, “How do you know it is accurate?”","","I answered, “Mine is the answer from heaven.” (When I look up to the sky, the name of the president will appear in the sky.)","","Every time I look up to the sky, it is always accurate. I only told a small number of people. When the results came out, every one of us knowingly smiled.","","The recent news media fabricated a lot of stories about me, and said that I was performing divination on behalf of someone for the presidential election.","","The news media denounced and laughed:","","“Asking gods and ghosts rather than asking people?”","","The media reporter made groundless accusations about me, and spouted nonsense.","","As to whether anybody had consulted me, these were also all unrealistic talks.","","The media asked me, “Did anybody consult you to perform divination for the presidential election?”","","I replied, “No.”","","The media asked, “Who will be elected?”","","I replied, “I know, but, I am not telling you.”","","(I secretly smiled in my mind. After all, the one who requested me to perform divination for who would be elected president was actually the media itself. I knew who would be elected, but of course I could not say who. It would create a great amount of chaos if I revealed it; moreover, if one party was identified, the other party would inevitably be offended.)","","Moreover, as an “outsider” monk and cultivator like me, I do not gain any benefit should a big matter like this spread. As a true cultivator, the worldly matters would automatically require the worldly people to manage. I did not want to be well known in this world because of this.","Actually, I am already quite famous. If I announced it, it would be a big problem.","Sheng-yen Lu","Someone asked, “Do you really know who will be elected president?”","I","I replied, “I know.”","","","I replied, “Heaven knows! Ha ha.”","","","And I also laughed, “Ha ha.”","","The worldly people also laughed, “Ha ha.”","","","Someone asked, “Who is it?”","The person who asked the question laughed, “Ha ha.”","This article was written on November 27, 2011. According to the presidential election poll, the difference between the two candidates was 0.4 percent, the difference was so small that it intensified the election atmosphere.","I remembered three months ago, the poll between the two presidential candidates still had a 20 percent difference! At that time, I had said “tight”!","","","","",""
"028 The Dim Light of the Long Corridor","https://reader.tbboyeh.org/fullscreen_player.php#/?ebook_id=1000043&chapter_id=c028","hile I was in Taiwan, the weather in winter was cold. Around ten o’clock at night, I would usually walk on foot from the seventh phase to the fifth phase of the residential district. The walk took about forty minutes.","","During the journey, I would exercise and chant.","","Walking from the seventh phase to the fifth phase required passing through several high-rise buildings of the seventh phase, several sections of traffic lights, three to five small lanes, and three to four big streets. I tried to walk on the pedestrian path as much as possible.","","In fact, it was impossible to walk mainly on the pedestrian path because some of the pedestrian paths were blocked by business signs.","","Blocked by the parked scooters.","Blocked by the parked cars.","Blocked by the “voltage transformer.”","Blocked by the construction work.","Blocked by the big tree.","","The newly-paved pedestrian paths were fairly pleasant to walk on; while the old paths were full of pot-holes and uneven, requiring one to walk with one foot higher than the other.","","I frequently had to take a detour and walk on the asphalt road surface for scooters. All these made me cautiously walk for forty minutes.","","I was used to taking “Shizheng North 2nd Road.” After passing by several tall buildings, I made a turn from “Shizheng North 2nd Road,” passed through a long corridor of a building, and then arrived at another big avenue. The light of this long corridor was dimmed at ten o’clock at night. This long corridor was rather long. It was a corridor of a building. It was very quiet with no one there; I quietly walked along this long corridor. I had been walking there for quite a while and had never encountered anybody walking on this long corridor.","","This long corridor belonged to one particular building. There were sculptures, high and big chandeliers, and very flat and smooth ground tiles. This section of the road made me feel very comfortable and happy.","","Originally, I was walking alone. Later on, the more I walked, the more I found something wrong. I could feel there were two adults and three children nearby following my footsteps.","","All along, I am bold and skillful. Hence, I did not bother.","I was not even afraid. I walked mine, and they walked theirs.","While I was walking on this long corridor, I started with chanting the Buddha’s epithet, or reciting [High King Avalokiteshvara Sutra], and at the end chanting “Amitabha Rebirth Mantra”…","","These five spirits, initially were:","","Walking behind me.","Walking around me.","","Later on, they were transformed to white stripes of light shadows dancing in front of me, just like five stripes of colored ribbons flying in the space.","","I did not chant or form any mudra to get rid of them. They also did not have any evil intentions towards me. We felt comfortable being together.","","Later on they raised a question, “This cultivator, who are you? You radiate light from your body.”","","I replied, “I am Grand Master Lu.”","","They said, “Oh! It is really Grand Master Lu. We have heard a lot about you. You have a well-known reputation, no wonder your body radiates rainbow light.”","","I asked them back, “Who are you then?”","","They replied, “In the original city planning, the seventh phase was a piece of deserted land with grass and weeds overgrown everywhere, and groups of stray dogs wandered around. In the middle, there were several ancient gravesites. We were one of the gravesites in which two adults and three children were buried; we were all grave-guarding ghosts. Later on, when the seventh phase was developed, many buildings were built, the graves and bones were completely dug up and dispersed, and we became the building-guarding ghosts. Originally, we shuttled among the empty buildings. After you came, we listened to your chanting of Buddhas’ name, of mantras, and of sutras. Your light and energy rubbed off on us and we could fly freely. From then, we could accumulate energy to form a body. We have to really thank you!”","","I said, “It is a casual acquaintance, and it is our affinity, so there is no need to thank me.”","","I also asked, “Where are you going in the future?”","","W","","I said, “Very good! I will accept you five ghosts to be my disciples. Follow me around, I will use my light to protect you all. Follow me on the path of cultivation!”","","","","","","","","","","(I really took these five ghosts [as disciples].)","","","","They replied, “We would like to follow Grand Master Lu to cultivate.”","","","",""
