"011 Vampire Ghosts Spoken by Master Lian-zhi","https://reader.tbboyeh.org/fullscreen_player.php#/?ebook_id=1000043&chapter_id=c011","here was once a dinner gathering.","After one week, the coffin was re-opened by everyone. Amazing! Amazing! The dead bodies had already started to decompose. The clothes that were originally new and bright, were now already bitten and damaged by the insects. They really became dead bodies.","Master Lian-zhi mentioned a true story about “Vampire Ghosts”:","From that day onward ---","There was a fellow disciple, who had a big family.","He answered, “Grand Master Lu lives so far away in Seattle, United States, and is very busy. It was when there was really no one else to consult, that I then started to remember.”","A family member passed away, but one month after the completion of all the funeral services, another person passed away.","","They thought that it was just coincidence and once again finished all the funeral services. But after twenty days later, a third person passed away.","","The strange thing was, this third family member was a young person who should not have died. A sense of foreboding permeated in the family.","","They hired a reverend to conduct purification and blessing ceremonies, and thought that everything should be fine. Unexpectedly, a fourth person died thereafter.","","Everyone in the family was panicking. Four family members had consecutively died in less than half a year.","","It was even more peculiar that a fifth person soon died!","","They hired another well-experienced Voodoo master to perform the “Body Substitution Practice,” and thought that with the help of a “substitute body” they could have peace in their mind.","","A sixth person died yet again!","","Oh my heavens! In less than a year, six family members died. Feng shui masters were hired to examine the “residence of the living” and the “burial grounds of the deceased.” The feng shui masters took a brief look and made some feng shui alterations.","","Once again, a seventh person died!","","The family was about to go insane and crazy. Everyone was so worried that he or she will be the next in line.","","Again, they hired eminent monks to conduct the “Emperor Liang Repentance,” the “Great Compassion Repentance,” the “Water Repentance,” the “Lotus Sutra Repentance,” the “Yogacara Ulkamukha (The Ritual for Feeding of Hungry Ghosts)” the “Offering of Food to the Spirits,” etc...","An eighth person died yet again!","","Help! Help! [They would hire] any popular reverend, Voodoo master, feng shui master, naturalist, taoist, astrologer, supreme master, master, living buddha, exorcist, etc …..","","Even doctors and scientists were completely baffled and did not know why a healthy person would just suddenly die.","","A ninth person died yet again!","","Oh Heavens! Oh Heavens! What else could be done?","","At this time, that fellow disciple who had taken refuge in Grand Master Lu happened to remember Grand Master Lu who was living far away in Seattle, United States.","","Nine family members died in a year.","","Is it not scary? They were making funeral arrangements almost daily.","Once I did the divination.","","The “Heavenly Official” and “Earth Killing” (Zi Wei Dou Shu) stars firmly stated that: “The paternal great-grandfather and great-grandmother were buried in a vampire land and have been transformed into vampire ghosts. Every night they fly out and absorb energy from living people, who in turn die when their energy is completely exhausted. If this continues on, more people will die.”","","I told Master Lian-zhi to go quickly and help.","I asked, “Why did you not consult me at the beginning?”","Choose a “Remove Day” afternoon to open the coffin.","T","Grab a handful of muddy soil and throw onto the bodies of the vampire ghosts.","","","Master Lian-zhi followed my instructions and together with a group of brave family members, went up to the grave site. When the coffin was opened, everyone was almost scared to death at the first glance!","","","Hairs had grown longer. (horrible)","","Finger nails had grown longer. (horrible)","","","This was the method to save [the living].","Both great-grandfather and great-grandmother were wearing burial clothes, hats, and shoes, and they were lying there as if alive.","Their faces looked alive with two fangs exposed. Exactly “vampire ghosts.”","When everyone saw the bodies, several of them stumbled off and ran away. The remaining people followed my edict to throw the muddy soil into the coffin and closed it.","","","","",""
"012 What was Being Carried in the Motorcycle’s Backseat?","https://reader.tbboyeh.org/fullscreen_player.php#/?ebook_id=1000043&chapter_id=c012","ne year, I returned to Taichung, Taiwan.","","On a street of Taichung, I saw a True Buddha School disciple riding a motorcycle and quickly passing by in front of me.","","I saw him, but he did not notice me. I saw on his back seat, a sexy girl with long hair. Dressed in a tiny outfit with legs exposed, the girl had both arms around the disciple.","","I was thinking in my mind:","","“Great! I could tease him tomorrow.” (He was married, had a wife, and still carried a sexy girl everywhere.)","","The next day.","","I asked, “Yesterday, around two o’clock in the afternoon, did you ride a motorcycle and pass by Wuquan Road?”","","He answered frankly, “Grand Master, you saw me?”","","I said, “Yes, who was riding in the backseat? What is your relationship with her?”","","He was horrified.","","I thought I had caught a “criminal.”","","He said, “I carried no one in the backseat!”","","I questioned, “She has long hair, wears a tight mini-skirt with exposed fair legs. I saw very clearly. Her two arms were tightly entwining your waist, and you deliberately pretended not to see me.”","","He was greatly startled, “Grand Master, I really did not carry anyone. Could Grand Master be mistaken? Please do not falsely accuse your disciple!”","","“You do not lie to Grand Master,” I said.","","“I dare not,” he said.","","At this time, I felt rather tense. This disciple never lies to people. If he said he did not carry anyone, he really meant it. But, what did I see? Could it be the “life-claiming ghost?”","","I used “Divination through the Fingers.” It was really a “life-claiming ghost” sitting in the backseat, I saw it using my Divine Eyes.","","I had to help my disciple, I said:","","Use a piece of red cloth and write down your personal eight characters of birth time, name, and address; then cut nails and hairs, wrap them all together and tie with red string.","","Pick an afternoon of a “Remove Day.”","","Hang the pouch in front of Avalokitesvara Bodhisattva’s chest.","","Pray for blessing and protection. (Then, nothing bad would happen.)","","A year passed by as usual and everything was fine.","","Later: On the twenty-fourth day of the first month of the new lunar year, while he was riding the motorcycle, he fell off from the motorcycle without reason. There was no accident too. He was quickly delivered to the hospital, but he died.","","The doctor diagnosed that he died suddenly due to a cerebral hemorrhage (stroke).","O","When I heard that he had passed away, I could not believe it since he was still young.","","","I went to his house.","","I asked his wife, “Where is the red cloth pouch?”","","His wife answered, “There was a red cloth pouch, but during the year-end cleanup, I saw the red cloth pouch was covered with dust. I took it out and threw it away!”","","“Oh Heavens!” I cried.","His wife questioned, “Is his death related to the red cloth pouch?”","Even though there was a “life-claiming ghost,” but I had already performed a special technique and he had the protection from Avalokitesvara Bodhisattva. How could he die?","I found that the shrine in his house had no red cloth pouch hanging on the chest of the principal deity, Avalokitesvara Bodhisattva.","","","","I answered, “That’s correct!”","I explained to his wife the entire matter in detail. Now that he was taken away by the “life-claiming ghost,” I must use my power to get him back and deliver him to the pure land of Maha Twin Lotus Ponds!","●","Yin and Yang are different, human and ghosts are unlike. You consume energy, but humans consume tangible food."
"013 What Fo-chi Lu Saw?","https://reader.tbboyeh.org/fullscreen_player.php#/?ebook_id=1000043&chapter_id=c013","he father of my daughter-in-law Shanshan Lu had passed away. My son, Fo-chi Lu, and Shanshan Lu brought back from Indonesia some of his ashes, which were placed in the lower level of the shrine, for memorial purpose.","","Unexpectedly, the soul of the father-in-law returned with them and stayed in Fo-chi Lu’s home in Seattle.","","Shanshan Lu could sense it.","","Fo-chi Lu could sense it.","","For example:","","Shanshan Lu could sense that her father was sleeping in the middle of two people, between Fo-chi and herself.","","Both of them would frequently and suddenly wake up in the middle of the night and sense that a third party existed in the bedroom.","","There was one time in the middle of the night.","","Fo-chi Lu suddenly woke up and took a look at Shanshan Lu who was sleeping beside him. He was so shocked by this glance.","","It was because the face of Shanshan Lu had turned into the face of his father-in-law.","","He let out a startled cry!","There was another time.","","Fo-chi Lu awoke in the middle of the night and saw his father-in-law floating in the space above and gradually moving closer towards him. Fo-chi Lu was greatly alarmed and involuntarily chanted from his mouth, “Om, gu-ru, lian-sheng, sid-dhi, hum.”","","At the same time, he pushed both hands out.","","Both hands manifested a ray of white light that radiated out and forced his father-in-law to retreat. Instantly, he disappeared.","","And more:","","The occurrences of this kind of “supernatural phenomenon” were quite frequent. He was Shanshan Lu’s father, Fo-chi Lu’s father-in-law, and our relative. But, the frequency of these occurrences was too high and was affecting their normal life.","","The young couple told me about it.","","I went to their home and performed water purification. Wherever I sprinkled the purified water, he quickly shunned away. I completely purified the whole house.","","He was forced to move outside the house.","","He said, “Master Lu (in-law), I cannot live outside. If I ever get seen by the Day Patrol God and the Night Patrol God, I will be taken away.”","I said, “Souls return to souls, dust returns to dust. You go to find your own destiny!”","","He said, “I wish to look after my daughter Shanshan Lu.”","","I said, “I understand that you want to protect your daughter, but their ordinary daily life will be affected if it is too obvious. It would be better if I deliver you to the Buddha pure land!”","","He said, “I am not familiar and I am afraid. I do not want to go.”","(He was a Catholic when he was alive, but he was not a staunch practitioner. He could neither go to heaven nor hell.)","","I asked, “Where do you want to go?”","","T","","I said, “I will transform the exquisite seven-layer pagoda into a house for you, and you can live in there! Remember, remain invisible as you are invisible. You cannot manifest to anyone anymore. Yin and Yang are different, human and ghosts are unlike. You consume energy, but humans consume tangible food. They provide offerings to you and you bless them. You also cannot affect my grandson Hong Lu and granddaughter Gin Lu. Would that be fine?”","He answered, “Fine!”","","From then on, the soul of the father-in-law never appeared again!","●","","The god of rain and god of wind all listened to my commands.","","Sheng-yen Lu","","","","","","He replied, “Stay beside Shanshan!”","","","",""
"014 The Great Ceremony Held on the Beach","https://reader.tbboyeh.org/fullscreen_player.php#/?ebook_id=1000043&chapter_id=c014","conducted the “Wildlife Release Ritual” on November 13, 2011 at half past one in the afternoon on the beach of Wushi Harbor of Toucheng Township, Yilan County.","In front of his bed, I opened my father’s heavenly gate which was directly connected to the Buddha pure land.","This extra-large outdoor ceremony on the “beach” was organized by:","Sheng-yen Lu","Master Lianyue.","Master Lianmiao.","Master Liandeng.","Dharma sister Zou Yilan.","Toucheng Township Mayor. (Chen Xiuyuan).","","This was also the first time in my life conducting a large ceremony on a beach facing the sea and “Turtle Hill Island”; it was really unprecedented.","","Its characteristics were:","","An extra high “dharma platform” was built on the beach, with its first-class sound and lighting features. (Also included were the Taiko Divine Drum and Nine Heavens Divine Drum.)","","On the dragon side of the beach, a “Kalachakra” sand mandala was set up with extraordinary grandeur.","","In front of Kalachakra, a statue of “Golden Mother of the Jade","Pond” was vividly crafted using sand mandala.","","There were altogether thirty-three stacks of little sand mandalas in the surrounding symbolizing Indra’s Heaven, with thirty-three gods.","","Fish fry were directly released into the sea in relay style. These kinds of fish fry belong to the same kind of fish which are richly produced in Wushi Harbor. Thus, the “same kind” entered into the “same kind.”","","The miracle was:","","Wushi Harbor had heavy rainfall continuously for over half a month, there was not one day without heavy rainfall, the rain stopped only on the day of the ceremony. After the ceremony finished, the rain continued once again non-stop.","","Wushi Harbor had very strong gusts of wind everyday with wind speeds of around level eight to ten. When I was seated at my dharma throne, I called, “Wind stop.”","","The gusty wind stopped at once.","","I (Living Buddha Lian-sheng), really can call upon the wind and rain.","I called the rain to stop, the rain really stopped.","I called the wind to stop, the wind really ceased.","","This was another big miracle. The god of rain and god of wind all listened to my commands.","","Does everyone still remember the “Mahamayuri” ceremony held at Taiwan Lei Tsang Temple?","","It was an outdoor ceremony and the sun was very hot, I asked Mahamayuri:","","“The Great Sun! Are you going to shine on my disciples until their skin peels off? Mahamayuri, please extend your two wings to cover the sun a bit!”","","It was only a short while, two pieces of huge black clouds, like birds’ wings, covered the sky above the ceremony site, and bursts of cool wind blew in, helping the attendees to feel relaxed and refreshed. (The clouds only appeared at the sky above the Lei Tsang Temple.)","","I said, “Clouds come.”","","Clouds came!","","I","","I was at the site of the “Senayan” great ceremony.","I exclaimed, “Rain come!”","","Fifteen minutes after the ceremony completed, pouring rain arrived all over Indonesia. Indonesia includes the Thousand Islands. The Thousand Islands were all covered with rainfalls and the drought was resolved.","(This scenario was reported by “Dongxie Magazine.”)","","I truly tell everyone:","","My ancestor Jiang Ziya was gifted with the “Almond Yellow Flag” by Yuanshi Tianzun, the Celestial Venerable of the Primordial Beginning, for calling support from all gods.","Once the “Almond Yellow Flag” is waved, all the gods from heaven and earth will follow the commands.","","","","","And during the big drought in Indonesia, there were five months without rain.","I did not have the “Almond Yellow Flag.”","But I have:","“Shakyamuni Buddha’s Edict.” (King of Buddhas)","“Golden Mother of the Jade Pond’s Edict.” (King of Immortals)"
"015 The Rebirth of My Father","https://reader.tbboyeh.org/fullscreen_player.php#/?ebook_id=1000043&chapter_id=c015","y father Lu Ershun was critically ill while I was still in Seattle of the United States around October to the beginning of November of 2011.","Vice President Shi of China Medical University Hospital.","Originally, I was scheduled to rush back to Taiwan to see him.","","Golden Mother of the Jade Pond said, “You can continue with your preaching schedule. We will be guarding your father and waiting for your return to Taiwan to see him one last time, and then your father will be delivered.”","","After I paid homage to “Golden Mother of the Jade Pond,” I went out of the main hall and prayed in front of the heavenly incense burner.","","This time, Avalokitesvara Bodhisattva manifested and told me, “Do not worry, Golden Mother and I will personally return to Taiwan and deliver your father to the Buddha pure land.”","","I felt greatly relieved once I heard that.","","I returned to Taiwan on the 3rd of November at seven o’clock in the morning and on the same day, I immediately rushed to the hospital to visit.","","I used my Vajrayana method of “Consciousness Transference Yoga.”","","Open the gate to heaven.","Close the door to earth.","Block the path to human rebirth.","Obstruct the ghost road.","","In front of his bed, I opened my father’s heavenly gate which was directly connected to the Buddha pure land.","","Not to be reborn in the realm of hell, hungry ghost, or animal.","Not to be reborn in the realm of human.","Not to be reborn in the realm of ghost.","(In this way, I then felt that everything was assured.)","","I returned to Taiwan on the 3rd of November. Only three days after, on the 6th of November, my father was reborn to the Buddha land.","","During cremation:","","The cremation produced one piece of Vajra sarira, four pieces of medium-sized sariras, and numerous small sariras.","There were innumerable sarira flowers.","","(Note: It was my mother, Lu Yunu, who delivered my father to the Buddha land. Through cultivation, she had already become Avalokitesvara Bodhisattva.)","","When my father Lu Ershun was still alive, he had a strong character and did not believe in anything. I had considerable difficulties converting him.","","Until he was old and weak, did he gradually initiate the mind of learning Buddhism.","","Every time I returned to Taiwan or in the year 2010 when I stayed in Taiwan for a year, my father would always attend every one of my ceremonies.","","He became part of the “Chasing after the Buddha” Group.","He received empowerment from every deity.","He always chanted the holy epithet of “Namo Guan Shi Yin Pu Sa.”","The Buddha seed was already planted.","It was just waiting to grow big and strong.","","Reverend Liandeng interviewed him and asked, “You are the father of Living Buddha Lian-sheng, Sheng-yen Lu, why do you pay homage to your son?”","","M","","After my father was reborn, he returned to see me once. He woke me up by touching my feet.","My father appeared in the space, carried a smile on his face and was coruscated with holy lights.","","I am very thankful to everyone who had looked after him:","Xiao Zhang.","Wang Zizhu.","Xu Hongchun couple.","Doctor Li Jialin.","Doctor Xie.","Master Lezhi.","","","Reverend Lianxing.","My four younger sisters and their husbands.","My father replied, “I am not paying homage to my son. Rather, I am paying homage to the Tathagata’s Wisdom of my son, which represents paying homage to Tathagata’s Being. In this way, can you understand?”","The immediate relatives of Shimu.","...","●","If there was a difficult problem, I would then write a note petitioning, “City God, please help!”"
"016 The City God and I are Good Friends","https://reader.tbboyeh.org/fullscreen_player.php#/?ebook_id=1000043&chapter_id=c016","was born at the Niuchou riverbank of “Back Lake” of Chiayi. In the year of 1945, the American army aircrafts bombed Chiayi. My parents fled and stayed at the chicken farm at Niuchou River and I was born at the chicken house.","","Coincidentally:","","“Jesus” was born in the stable.","“Sheng-yen Lu” was born in the chicken house.","","I was a premature baby and therefore difficult to raise. I was adopted by the “City God” of Chiayi as his godson.","","That means when I was born, the “City God” deities and I had formed a virtuous affinity.","","Excellent!","Excellent!","","Later on, I understood that “City God” was differentiated by numerous rankings:","","Capital City God.","Prefectural City God.","County City God.","Village City God.","(There is even a small City God in Tainan.)","","After my Divine Eyes were initiated, the “City God” of Zhongxiao Road in Taichung and I became close friends.","","I remembered when I was at Buddhist Lotus Society of Minsheng Road in Taichung, there were several Buddhist friends such as “Lay Practitioner Yuan,” “Lay Practitioner Jiang,” and “Lay Practitioner Wen,” and so on, who knew I had psychic power and consulted me on certain matters.","","I calmed my mind.","","I could see a person descending from the space, wearing a red robe, crowned with a black hat [worn by feudal officials], his appearance upright and dignified. He was, without a doubt, the City God of Taichung.","","One by one, the lay practitioners asked their questions.","","I asked the City God.","","The City God replied one after another.","","The lay practitioners gave the thumbs-up. They shouted, “The divination is so accurate!”","","At that time, I was in Taichung helping people out with their questions by providing consultations. If there was a difficult problem, I would then write a note petitioning, “City God, please help!”","","The person who came for consultation would then take the note to the City God temple and burn it together with joss paper.","Matters would then be resolved.","","Do you find it strange or not?","","When I taught the “Practice of Praying for a Son,” it was also done by praying to the City God in Taichung. In that year, who knows how many were successful in obtaining a son by this Practice of Praying for a Son from the Taichung City God?","","In that year, the “Hat of City God” could cure lots of hard-to-treat illnesses. Take the Hat of City God, put it on the head of the patient three times, and surprisingly the sicknesses would bizarrely be cured.","","Isn’t it strange?","","I","","Everyone is very familiar with the incident of Deputy Commander Wei Ching Ping. Let me repeat one more time here:","Wei Ching Ping and I went to “Gongbei Mountain” of Penghu Island to do land surveying.","","Wei was holding some coins and said to me, “Survey Officer Lu, I have some coins clenched in my fist. You say you can perform divination. I will believe you if you can guess right. Otherwise, from now on, please do not talk about Buddhist dharma in the army!”","I was provoked. I could only calm my mind.","","At this time, the City God of Penghu came and told me, “Fourteen pieces.”","","I answered, “Fourteen pieces.”","Deputy Commander Wei Ching Ping opened his palm and counted the coins. When he counted to thirteen pieces, only one piece was left on his hand. The final count was precisely fourteen pieces.","","","","","At that time, I was still in the army.","Wei Ching Ping said, “I believe you now!”","From then on, Wei Ching Ping chanted the Buddha’s name continuously until today. He has been my witness twice; once at Taoyuan Stadium, the other at Taiwan Lei Tsang Temple.","I truly tell everyone, the fact that I am friends with gods is real.","●"
