"034 Giving Myself Mo-ding to Uncover the Mind Terma","https://reader.tbboyeh.org/fullscreen_player.php#/?ebook_id=1000016&chapter_id=c034","ecently I have often been placing my hand atop my head to empower my brain. The results have been amazing. The teachings of the Nine Stages of Great Perfection Dharma have been emerging in my mind-stream.","The three Sutrayana vehicles were spoken by Shakyamuni Buddha.","After I finish a self-empowerment:","A stream of smoke appears.","Then drops of starlight appear.","Amidst the light were words.","","I was greatly astonished by them. The teachings of the Nine Stages of Great Perfection Dharma then manifested one by one in my mind-stream.","","In a flash, I remembered that these were the words of the Buddhadharma I had known in previous lives. This was uncovering of the mind terma.","Additionally, I received the “most profound pure awareness lineage.”","","In Nyingma I altogether inherited three lineages:","","Human gurus: Norlha Rinpoche - Reverend Liaoming - Living Buddha Lian-sheng.","","Mind terma: Padmasambhava - Trisong Detsen - Living Buddha Lian-sheng.","","And “most profound pure awareness lineage”: with this, when I meditate, not only am I able to uncover the terma hidden in my mind-stream, I also receive revelations from buddhas, bodhisattvas, and lineage gurus.","","They allow me to understand not just intellectually the Nine Stages of Great Perfection, but also teach me the mechanics of the actual practice.","","(During meditation, dreams, and visions, I receive instructions and guidance from various deities.)","","This kind of “most profound pure awareness lineage” happens to very few people in the world. And I am one of those few.","","It is very rare.","It is very honorable.","","We know that:","","In shravakayana, practitioners work on the Four Noble Truths, “suffering, accumulation, cessation, and path” to attain arhathood.","","In pratyekabuddhayana, practitioners work on the “twelve links of interdependent origination” to attain the enlightenment of a “lone buddha.”","","In bodhisattvayana, practitioners work with the “six paramitas” to attain bodhisattvahood.","","(The above three yanas belong to the Sutrayana vehicles.)","In kriya tantra, practitioners work on action tantra to attain buddhahood in seven human lifetimes.","","In charya tantra, practitioners work on performance tantra to attain buddhahood in five human lifetimes.","","In yoga tantra, practitioners work on One Taste to attain buddhahood in three human lifetimes.","","(The above three yanas belong to the Outer Tantras vehicles.)","","In mahayoga tantra, practitioners work on the generation stage practices to realize the manifestations of enlightenment in the physical world, the nirmanakaya.","","In anuyoga tantra, practitioners work on the completion stage practices to realize the reward-body, the sambhogakaya.","","In atiyoga tantra, practitioners work with mind, space, and pith-instructions to understand and glimpse into the nature of mind.","","","Applying my hand to empower my own mind, I have completely mastered the Nine Stages of Great Perfection Dharma.","","R","(The above three yanas belong to the Inner Tantras vehicles.)","","The three Outer Tantras were spoken by Vajrasattva.","","The highest realm of atiyoga is also what I, Living Buddha Lian-sheng, have often discussed in my discourses:","Thus I declare:","The three Inner Tantras were spoken by Samantabhadra Tathagata.","","“Leaping Over.” (togel)","In this essay, I primarily wish to explain how I came by my comprehension of the Nine Stages of Great Perfection Dharma. Also, I want to reveal the sources of my three great lineages:"
"035 The Origin of the Lineage Transmission of Great Perfection Dharma","https://reader.tbboyeh.org/fullscreen_player.php#/?ebook_id=1000016&chapter_id=c035","ccording to my knowledge:","","The Nine Stages of Great Perfection Dharma flowed from the perfect awareness of the Primordial Buddha Samantabhadra Tathagata. First the Primordial Buddha imprinted this teaching upon the minds of the Five Dhyani Buddhas: Vairocana Buddha, Akshobhya Buddha, Amitabha Buddha, Ratnasambhava Buddha, and Amoghasiddhi Buddha, as well as all the buddhas.","","Next, the Five Dhyani Buddhas also used the mode of mind to mind transmission to pass teachings to Vajrasattva with the sambhogakaya body.","This mind direct transmission of the buddhas bypasses written or spoken language. It is like pouring milk directly into a milk bottle.","","This mind to mind transmission is also known as esoteric mind transmission.","","Later, Vajrasattva transformed into Manjushri, Avalokitesvara, and Vajrapani, the symbols of wisdom, compassion, and strength respectively, and used the sign transmission of the vidyadharas to transmit the lineage to devas, nagas, and yakshas.","","At the Trayastrimsa Heaven in the celestial realm, Semlhag Chen was the head of the five hundred devas. After experiencing four auspicious signs in his dream, Semlhag Chen received lineage transmission from Vajrapani. He also received the empowerment and transmission of the Dzogchen tantras.","","Later Semlhag Chen was born into the human realm in the land of Uddiyana as Garab Dorje.","","Garab Dorje also received empowerment from Vajrapani, attained realization, and became the first human guru of Dzogchen.","","Next, Garab Dorje transmitted the teachings to Manjushrimitra, Manjushrimitra transmitted the teachings to Shri Singha, and Shri Singha transmitted the teachings to Padmasambhava, Vairotsana, Vimalamitra, and Jnanasutra.","","Finally, Padmasambhava entered Tibet and transmitted the lineage of the Nine Stages of Great Perfection Dharma to the Tibetan King Trisong Detsen and Yeshe Tsogyal. This kind of transmission is known as oral transmission by humans.","","Thus, lineages of transmission can be categorized as:","","“Mind direct transmission of the buddhas,”","“Sign transmission of the vidyadharas,”","“Oral transmission,”","“Mind transmission,” “Terma transmission,”","“Most profound pure awareness transmission.”","","In the category of terma transmission, Jigme Linpa and Longchenpa have made the most contribution.","","And I, Living Buddha Lian-sheng Sheng-yen Lu, have the following lineages of transmission:","","1. Oral transmission (from Reverend Liaoming)","2. Mind transmission (from Padmasambhava)","3. Most profound pure awareness (from the buddhas)","","Additionally, terma transmission may also be included as Padmasambhava had hidden the teachings of the Nine Stages of Great Perfection Dharma in the mind-stream of King Trisong Detsen who had since undergone repeated incarnations. I only have to lay my hand on my own head to empower it, and the sadhanas and tantras of the Great Perfection Dharma will flow continuously and unceasingly to reveal themselves.","","Here I would like to mention that among all the Tibetan Tantrayana schools, the Nyingma School is the most ancient. The three well known masters from the Zur clan had systematically sorted out the Nyingma scriptures.","","Compared to the other three schools, Nyingma is less organized. This is because they do not have an actual leader, a centralized monastery, or a core organization. The other three schools of Gelug, Sakya, and Kagyu all have leaders at their core.","","Yet, the teachings of the Nine Stages of Great Perfection Dharma rank at the top of all teachings and are the most precious.","","All other dharma teachings are its side branches.","","●","","In Great Perfection Dharma, even the body can achieve the ultimate dissolving into rainbow light and attainment of Buddhahood.","","Sheng-yen Lu","","","","A","","","","","","","","","",""
"036 The Functions of Great Perfection Dharma","https://reader.tbboyeh.org/fullscreen_player.php#/?ebook_id=1000016&chapter_id=c036","reat Perfection Dharma is good and virtuous. Great Perfection Dharma is happiness and joy.","Great Perfection Dharma is supreme.","Great Perfection Dharma is the highest realm, the apex, of Buddhadharma.","Great Perfection Dharma is perfect and flawless.","Long live the Great Perfection Dharma!","There are countless functions of Great Perfection Dharma. Listed below are some of the results when one practices Great Perfection Dharma:","","1. Good health","2. Pleasant mood","3. Balance of body and mind","4. Transformation of body and mind","5. Liberation of body and mind","6. Buddhahood in the present body","7. Buddhahood in the present life","8. Attaining the rainbow body","9. Dissolving of the body into Light Body","10. Attaining the Rainbow Body of Great Transference","","A healthy body comes from the “strengthening” and “tempering” practices of Nine Cycles Breathing (Jiujiefofeng), Treasure Vase Qi (Baopingqi), Vajra Recitation (Jingangsong), inner fire, drops, non-leakage, and Vajra Fists Exercise.","","By practicing “opening the central channel,” “opening the seven chakras,” “opening all channels and meridians,” and by “understanding the nature of mind” and “recognizing the Buddha-essence,” one becomes quiet in mind and peaceful in disposition. One thus enjoys a pleasant mood.","","A healthy body and a peaceful mind constitute “balance of body and mind.”","","Practicing this way will lead to “transformation of body and mind” and “liberation of body and mind.”","","In Great Perfection Dharma, there are the “light viewing method” and the “retreat practice” that can help one achieve accomplishment in one lifetime.","","In Great Perfection Dharma, even the body can achieve the ultimate dissolving into rainbow light and attainment of Buddhahood.","","One thus attains liberation and spontaneous accomplishment!","","I know that:","","Lama Bai Puren was among the earliest disseminators of Nyingma practice in China.","","When Lama Norlha Rinpoche of Kham came to the mainland to teach, Reverend Liaoming forged an affinity with him. Reverend Liaoming is my Nyingma Root Guru.","","Norlha Rinpoche also invited Gangkar Rinpoche to the mainland to disseminate the dharma. Gangkar Rinpoche taught at the cities of Chengdu, Kunming, Chongqing, and Nanjing. For a period of time Tantrayana teachings flourished there.","","Thubten Nyima also taught in mainland China and transmitted the lineage to Thubten Dali. Thubten Dali transmitted the lineage to Thubten Dargye, and Thubten Dargye transmitted the lineage to Thubten Qimo.","","(Living Buddha Lian-sheng Sheng-yen Lu is Thubten Qimo.)","","Zhangjia Rinpoche has taught in China. Ganzhu Rinpoche has also taught in China.","","I personally feel that Norlha Rinpoche was more systematic in his transmission of the Great Perfection Dharma.","","Regarding Gangkar Rinpoche, although he is a lineage holder of Kagyu Mahamudra, he also knows the Great Perfection Dharma. Gangkar Rinpoche has lineage transmissions from both Nyingma and Kagyu.","","I have read Longchenpa’s writings on Great Perfection Dharma. He used Guru Yoga as a starting point as well as an end point. This is something very special.","","","1. One cannot practice Tantrayana from books alone.","2. The essence and pith-instructions require transmission from one’s guru.","G","These are my personal statements:","4. The Great Perfection Dharma is most excellent.","●","After chanting a sutra to deliver her boyfriend, I turned his soul to the Wheel-Turning Sage King.","","3. One needs to receive empowerments.","","Sheng-yen Lu","",""
"037 A Powerful Guardian Spirit","https://reader.tbboyeh.org/fullscreen_player.php#/?ebook_id=1000016&chapter_id=c037","lady came to see me who had a flawless face, as beautiful as that of a heavenly being. When we first met, I was a little in awe by her beauty.","","Besides being a dazzling and charming beauty, she was highly educated and had led a rich, varied life. She was raised in an upper middle class family. However, she had a little regret in her life. At the age of thirty, she was still single.","","In today’s world, some women are not interested in marriage, just as some men prefer to remain bachelors. But, that was not her case. She begged me to give her a mo-ding blessing, so she could find Prince Charming soon.","I gave her a mo-ding.","","It did not work.","","I gave her a second mo-ding.","","Nothing happened.","","A third mo-ding.","","Still no luck.","","She could not help but feel somewhat disappointed. A mo-ding from Grand Master Lu was always efficacious, but why was it unsuccessful in her case?","","Was there a lack of pursuers?","","No! The pursuers were as numerous as a school of silver carps. But many of them did not meet her high expectations, and she was too proud to stoop to someone she felt was lesser than her.","","There were also a few well-matched to her, but every time they reached a discussion about marriage, accidents would happen.","","One boyfriend was killed in a car accident.","","One boyfriend suddenly broke his leg and became lame. Another boyfriend had a stroke.","","And yet another became afflicted with muscular dystrophy.","","All the people who had proposed to her either died or became injured. It was indeed very strange.","","I also found this bizarre.","","I later asked my Yidam, “Will she get married?”","","The Yidam answered, “Yes!”","","“Why is she still unmarried then?”","","The Yidam answered, “Her guardian spirit is too powerful.”","","“Who is her guardian spirit?”","","The Yidam answered, “It is her first boyfriend. They were engaged and about to be married. He got into a car accident and died. After his death, he became her guardian spirit. He regards himself as her husband. Whenever any man tries to get close to her, he tries his best to break them up!”","","Wow! I finally learned the reason! I asked this lady if these events were true, and she confirmed it. Her first boyfriend was killed in a car accident three days before their wedding.","","I thought of a solution. After chanting a sutra to deliver her boyfriend, I turned his soul to the Wheel-Turning Sage King.","","I performed a “boundary protection” around the lady. And then I gave her another mo-ding blessing.","After all these, she finally was getting married. She even sent me a wedding invitation. I did not attend the wedding but sent her a wedding gift.","","Recently, I have heard she is pregnant. I am secretly happy for her. Hence, as long as one is able to find the “knot” and unfasten it, one’s problem will definitely be solved!","A","","●","After a long period of time, her parents secretly took her to the temple to see me.","Sheng-yen Lu","","","","","",""
"038 The Grandmother Guardian Spirit","https://reader.tbboyeh.org/fullscreen_player.php#/?ebook_id=1000016&chapter_id=c038","his is the account of a very pretty young college student. She had elegant brows and beautiful eyes, as well as ruby lips and pearly white teeth.","","She had many pursuers and was always involved in romances. Being a generous spirit who was naturally poised, she found herself often in the limelight and many at her school considered her the most beautiful girl there.","","But one day, her legs suddenly became limp and she was unable to stand up.","She was paralyzed!","","She could only attend school in a wheelchair.","","After the onset of paralysis, her friends, one by one, began to keep her at arm’s length. She understood that this was just the fickleness of human nature. People who knew her all felt sympathy for her, but the number of friends in her circle dwindled.","","Despite all this, she managed to focus her energy studying and continued to get good grades in college.","","Her parents took her to see many famous doctors, both western and Traditional Chinese medical doctors, but to no avail.","","MRI scans showed nothing wrong with her brain, bones, nerves, muscles, or tendons.","","They consulted jitong, the traditional mediums in temples, and after ingesting talismans, incense ashes and taking ablution with remnants of incense sticks, there was no improvement.","","They then turned to alternative therapists such as massage therapists, chiropractors, masseuses, acupuncturists, diviners using the Book of Changes, and bone-setters. After exhausting all methods, her parents were still unable to help their beloved daughter stand up.","","Why was this happening? No one knew.","","Someone then introduced them to me.","","Her parents wanted to come, but they encountered sarcastic comments from the dharma teacher they had taken refuge in:","","“There is no need to see this person!”","","“Everything about him is fraudulent!”","","“I have so much disdain for this person that I cannot even mention his name!”","","“He is a fake living buddha!”","","“It is not right to talk about subjects of extraordinary things, feats of strength, disorder, and spiritual beings!”","","The teacher her parents had taken refuge in was considered quite famous in the Buddhist circles. He did not like Grand Master Lu and thus tried to prevent them from coming to see me.","","After a long period of time, her parents secretly took her to the temple to see me.","","After I gave her a mo-ding, I looked at the light in my palm and saw an elderly woman with both legs entwined and immobilized by vines.","","I asked my Yidam, “What does this mean?”","","My Yidam replied, “Her grandmother is her guardian spirit. Since her guardian spirit’s legs are tied up, this young girl’s legs thus became limp.”","","I suggested the family excavate her grandmother’s casket. When the casket was opened,","","“Bingo!”","","Indeed, vines had coiled around both the grandmother’s feet. They simply cut up the vines and removed them.","The first day after the vines were cut, the college girl felt strength slowly coming back to her legs.","","Finally, she was able to stand up. Now how strange is this!","T","","●","The lady in white said, “If I help heal you, you must take refuge in Grand Master Lu!”","Sheng-yen Lu","","","","","",""
"039 The Healing of Skin Allergies","https://reader.tbboyeh.org/fullscreen_player.php#/?ebook_id=1000016&chapter_id=c039","woman brought three photographs to me and asked me to bless the man in the pictures.","●","I asked, “Who is he?”","","The woman replied, “He is my elder brother.”","I asked, “What happened to your elder brother?”","","She replied, “My elder brother has developed sensitive skin over his entire body. He cannot stop itching and scratching. Presently, from head to toe, he is covered with sores and inflamed and ulcerated skin.”","","I asked, “Has he seen doctors?”","","She said, “He has gotten injections, taken pills, and applied creams and ointments. They have tried antibiotics, steroids, everything. But nothing works.”","","I carefully looked at the three pictures of the man, and I was greatly shocked. Indeed from head to toe, chest to back, arms to legs, there was not one spot of skin that was not severely affected. Those ulcerations would send a shudder through anyone looking upon them.","","I said, “Ask him to chant the Earth God Mantra half a million times.”","","The woman said, “He has already chanted a hundred thousand times.”","","I said, “Just continue to chant it!”","","I visualized myself transforming into my Yidam and used my hand to touch and stroke the man in the picture. The Cosmic Flow of Dharma flowed from my hand onto the photograph.","","I said, “It will be done!”","","The woman asked, “What will be done?” I replied, “A miracle will happen!”","","It is said –","","The woman’s elder brother had a dream.","","He saw a lady wearing white with a dignified appearance who approached and asked him, “What is wrong with your body?”","","He replied, “I have severe skin allergies.”","","The lady in white said, “If I help heal you, you must take refuge in Grand Master Lu!”","","He responded, “Of course. I have already chanted the Earth God Mantra one hundred thousand times. Grand Master Lu asked me to chant half a million. I am still doing my chanting!”","","The lady in white took out a vase and poured out some water. She then used a branch dipped in the water to sprinkle water over his entire body.","","In his dream, he felt a very cooling effect from the water which soothed his skin.","","He also saw many tiny black bugs crawling out of his skin. They dropped to the ground and disappeared.","","The lady in white said, “Your skin ailment will be healed, except for one spot on the back of your hand. When you finish chanting a half million times of Earth God Mantra, that spot will heal on its own.”","","Then she took off.","","He wanted to chase after her, but he woke up from his dream. Ever since that day, the ulcers started drying and stopped itching.","The markings on his skin gradually faded and about a month later, they were gone, except for one spot upon the back of one hand that still festered.","","","I said, “The lady in white was Guanyin Bodhisattva. Just go and thank the bodhisattva!”","","A","He came to take refuge in me.","","","","Sheng-yen Lu","Later, that one spot upon the back of his hand also healed completely!","I asked, “Does the holy sage know about Madhyamaka (the Middle Way)?”","","",""
"040 Descent of Taoist Spiritual Master Ziyang Zhenren","https://reader.tbboyeh.org/fullscreen_player.php#/?ebook_id=1000016&chapter_id=c040","ne day, while meditating, my hands automatically formed the “Hook Invocation Mudra” and the “Holy Sage Mudra.”","","A celestial being suddenly descended from the empty space and glided before me, and I asked in great joy, “Holy sage, who are you?”","","He replied, “I am Ziyang Zhenren (True Man of Purple Yang).”","I asked, “Does the holy sage know of the inner fire practice?”","","Ziyang Zhenren replied,","“It is the natural true fire inside one’s body. By practicing tu-na (inhalation and exhalation) diligently daily, the fire grows redder in the hearth and becomes as marvelous as the divine serpent.”","","I asked, “Does the holy sage know about Madhyamaka (the Middle Way)?”","","Ziyang Zhenren replied, “This school is most holy and divine. It recognizes equanimity without an iota of discrimination. Regardless of what buddha or bodhisattva one is, it just happens coincidentally after all.”","","I asked, “Does the holy sage know of the Divine Water Practice?”","","Ziyang Zhenren replied, “This is the ultimate treasure of humans. As the divine water sways in the splendid pool and merges with the inner fire, all magical and subtle dramas manifest.”","","I asked, “Does the holy sage know about non-leakage?”","","Ziyang Zhenren replied, “What is so wonderful about this method is that it redirects seed energy, but be cautious not to waste it. It is a method not to be taken lightly. Once you achieve this, everything else can be put to rest.”","","I asked, “Does the holy sage know about the importance of abiding in precepts?”","","Ziyang Zhenren replied, “I have practiced eight hundred virtuous deeds and accumulated three thousand meritorious deeds unbeknownst to others. I helped people resolve attachments and enmities. These were the vows I carried out to achieve accomplishment.”","","I asked, “Does the holy sage understand Zen?”","","Ziyang Zhenren replied, “This school fathoms truth through insight into the nature of mind. There exist infinite permutations of manifestations of the source, and a return to the source is ineffable. Great miraculous powers develop when one returns to one’s source.”","","I asked, “How does one subjugate troubles?”","","Ziyang Zhenren replied, “There is no need to subjugate troubles. True knowledge cannot be obtained forcefully. There is neither antecedence nor posterity, and at the instance of understanding this, one attains Buddhahood.”","","I asked, “What is non-meditation?”","","Ziyang Zhenren replied, “After realization, there is automatically non-meditation. Form and emptiness, light and darkness, they are the same. Does the duality of truth and falsehood truly exist? From ancient India to Caoxi (the mountain name of Huineng), the dharma propagates and flourishes.”","","I asked, “How can one abide in neither good nor evil?”","","Ziyang Zhenren replied, “Wear nothing on your mind! This mind is empty and nameless. Rest in the flow and let everything be spontaneously accomplished. Follow your nature, eat when hungry and drink when thirsty.”","","I asked, “What is Endurance in the Realization that Dharmas have No Birth?”","","Ziyang Zhenren replied, “Karmic cause and effect exists in the human and deva realms. When causes and conditions are exhausted, one returns to the source. All love and hatred are merely plays, dreams, and smoke.”","","I said, “What you have said, I also know.”","","Ziyang Zhenren said, “You know, I know, yet others do not know.” Ha ha ha!","","Ziyang Zhenren laughed aloud as he took off.","","","Garab Dorje wrote down the Dzogchen teachings in verses.","","O","●","","","","","Sheng-yen Lu","","","",""
